InventoryId,ScheduleId,CarrierCode,Dep_Key,FlightNumber,AircraftType,DepartureDate,DepartureDatetime,ArrivalDatetime,DepartureAirport,ArrivalAirport,TotalCapacity,TotalInventory,BookedInventory,Oversold,AvailableInventory,FirstClass,BusinessClass,PremiumEconomyClass,EconomyClass,FC_TotalInventory,FC_BookedInventory,FC_Oversold,FC_AvailableInventory,BC_TotalInventory,BC_BookedInventory,BC_Oversold,BC_AvailableInventory,PC_TotalInventory,PC_BookedInventory,PC_Oversold,PC_AvailableInventory,EC_TotalInventory,EC_BookedInventory,EC_Oversold,EC_AvailableInventory,FC_CD,BC_CD,PC_CD,EC_CD,canCancel,Status
INV-ZZ-6984919,SCH-ZZ-9117133,ZZ,ZZ20240403BLRCCU2504,2504.0,Boeing 777,04/03/2024,2024-04-03 15:35:00,2024-04-03 18:17:00,BLR,CCU,425.0,481,295,-130,186,42,85,127,170,49,30,12,19,96,59,26,37,142,87,40,55,192,118,52,74,"{'F': 13, 'P': 6}","{'C': 23, 'J': 7, 'Z': 7}","{'Q': 27, 'R': 16, 'S': 0, 'T': 0, 'H': 12, 'M': 0}","{'Y': 10, 'A': 12, 'B': 6, 'D': 2, 'E': 0, 'G': 12, 'I': 2, 'K': 9, 'L': 2, 'N': 3, 'O': 2, 'U': 9, 'V': 3, 'W': 2, 'X': 0}",TRUE,Cancelled
INV-ZZ-9589851,SCH-ZZ-2729891,ZZ,ZZ20240404GOIMAA4516,4516.0,Airbus A320-200,04/04/2024,2024-04-04 06:48:00,2024-04-05 02:04:00,GOI,MAA,150.0,178,112,-38,66,15,30,45,60,17,11,4,6,35,22,8,13,54,34,11,20,66,41,19,25,"{'F': 5, 'P': 1}","{'C': 7, 'J': 5, 'Z': 1}","{'Q': 9, 'R': 5, 'S': 0, 'T': 0, 'H': 6, 'M': 0}","{'Y': 3, 'A': 4, 'B': 0, 'D': 1, 'E': 1, 'G': 3, 'I': 2, 'K': 4, 'L': 2, 'N': 0, 'O': 0, 'U': 2, 'V': 2, 'W': 0, 'X': 1}",FALSE,On Time
INV-ZZ-8199494,SCH-ZZ-9117133,ZZ,ZZ20240404BLRCCU2504,2504.0,Boeing 777,04/04/2024,2024-04-04 15:35:00,2024-04-04 18:17:00,BLR,CCU,425.0,486,305,-120,181,42,85,127,170,47,29,13,18,98,61,24,37,142,89,38,53,201,126,44,75,"{'F': 11, 'P': 7}","{'C': 13, 'J': 16, 'Z': 8}","{'Q': 21, 'R': 12, 'S': 2, 'T': 3, 'H': 12, 'M': 3}","{'Y': 8, 'A': 12, 'B': 1, 'D': 2, 'E': 4, 'G': 8, 'I': 5, 'K': 9, 'L': 2, 'N': 1, 'O': 2, 'U': 7, 'V': 5, 'W': 5, 'X': 4}",FALSE,On Time
INV-ZZ-1103211,SCH-ZZ-6536717,ZZ,ZZ20240405GAUBOM2526,2526.0,Boeing 717,04/05/2024,2024-04-05 15:59:00,2024-04-06 05:45:00,GAU,BOM,100.0,119,69,-31,50,10,20,30,40,11,6,4,5,23,13,7,10,33,19,11,14,45,26,14,19,"{'F': 4, 'P': 1}","{'C': 4, 'J': 2, 'Z': 4}","{'Q': 6, 'R': 4, 'S': 0, 'T': 1, 'H': 3, 'M': 0}","{'Y': 2, 'A': 3, 'B': 0, 'D': 0, 'E': 1, 'G': 3, 'I': 2, 'K': 2, 'L': 1, 'N': 0, 'O': 0, 'U': 3, 'V': 0, 'W': 0, 'X': 2}",TRUE,Cancelled
INV-ZZ-2384101,SCH-ZZ-7589545,ZZ,ZZ20240406MAATRV2008,2008.0,Boeing 787,04/06/2024,2024-04-06 02:25:00,2024-04-06 21:44:00,MAA,TRV,270.0,322,196,-74,126,27,54,81,108,31,19,8,12,62,38,16,24,94,57,24,37,120,73,35,47,"{'F': 10, 'P': 2}","{'C': 15, 'J': 6, 'Z': 3}","{'Q': 22, 'R': 8, 'S': 0, 'T': 0, 'H': 7, 'M': 0}","{'Y': 4, 'A': 5, 'B': 1, 'D': 3, 'E': 2, 'G': 5, 'I': 2, 'K': 6, 'L': 3, 'N': 2, 'O': 3, 'U': 4, 'V': 2, 'W': 2, 'X': 3}",TRUE,Cancelled
INV-ZZ-2109580,SCH-ZZ-3820040,ZZ,ZZ20240406MAATRV2047,2047.0,Boeing 767,04/06/2024,2024-04-06 07:41:00,2024-04-07 02:50:00,MAA,TRV,278.0,327,189,-89,138,27,55,83,111,32,18,9,14,62,36,19,26,99,57,26,42,132,76,35,56,"{'F': 7, 'P': 7}","{'C': 14, 'J': 9, 'Z': 3}","{'Q': 18, 'R': 12, 'S': 0, 'T': 1, 'H': 10, 'M': 1}","{'Y': 6, 'A': 7, 'B': 4, 'D': 3, 'E': 2, 'G': 6, 'I': 2, 'K': 7, 'L': 0, 'N': 4, 'O': 3, 'U': 8, 'V': 2, 'W': 2, 'X': 0}",TRUE,Cancelled
INV-ZZ-6903609,SCH-ZZ-7068651,ZZ,ZZ20240406CCUHYD3723,3723.0,Boeing 787,04/06/2024,2024-04-06 16:19:00,2024-04-07 00:54:00,CCU,HYD,270.0,303,190,-80,113,27,54,81,108,32,20,7,12,61,38,16,23,92,58,23,34,120,75,33,45,"{'F': 10, 'P': 2}","{'C': 9, 'J': 5, 'Z': 9}","{'Q': 13, 'R': 11, 'S': 3, 'T': 0, 'H': 7, 'M': 0}","{'Y': 6, 'A': 5, 'B': 3, 'D': 4, 'E': 3, 'G': 4, 'I': 1, 'K': 5, 'L': 1, 'N': 2, 'O': 2, 'U': 5, 'V': 0, 'W': 3, 'X': 1}",TRUE,On Time
INV-ZZ-3174758,SCH-ZZ-2312688,ZZ,ZZ20240406MAATRV4122,4122.0,Boeing 787,04/06/2024,2024-04-06 19:54:00,2024-04-07 02:05:00,MAA,TRV,270.0,303,187,-83,116,27,54,81,108,31,19,8,12,63,39,15,24,90,56,25,34,122,75,33,47,"{'F': 8, 'P': 4}","{'C': 9, 'J': 7, 'Z': 8}","{'Q': 13, 'R': 7, 'S': 1, 'T': 1, 'H': 11, 'M': 1}","{'Y': 6, 'A': 8, 'B': 4, 'D': 1, 'E': 2, 'G': 5, 'I': 3, 'K': 8, 'L': 0, 'N': 1, 'O': 2, 'U': 6, 'V': 1, 'W': 0, 'X': 0}",TRUE,Cancelled
INV-ZZ-3417474,SCH-ZZ-7589545,ZZ,ZZ20240407MAATRV2008,2008.0,Boeing 787,04/07/2024,2024-04-07 02:25:00,2024-04-07 21:44:00,MAA,TRV,270.0,298,177,-93,121,27,54,81,108,31,18,9,13,63,37,17,26,94,56,25,38,124,74,34,50,"{'F': 6, 'P': 7}","{'C': 12, 'J': 7, 'Z': 7}","{'Q': 18, 'R': 9, 'S': 5, 'T': 1, 'H': 4, 'M': 1}","{'Y': 7, 'A': 8, 'B': 0, 'D': 0, 'E': 2, 'G': 6, 'I': 2, 'K': 7, 'L': 0, 'N': 3, 'O': 3, 'U': 6, 'V': 2, 'W': 2, 'X': 2}",TRUE,Cancelled
INV-ZZ-7038387,SCH-ZZ-3750409,ZZ,ZZ20240407DELBOM4516,4516.0,Boeing 767,04/07/2024,2024-04-07 05:29:00,2024-04-07 15:51:00,DEL,BOM,278.0,324,205,-73,119,27,55,83,111,31,20,7,11,61,39,16,22,94,59,24,35,124,78,33,46,"{'F': 8, 'P': 3}","{'C': 15, 'J': 5, 'Z': 2}","{'Q': 11, 'R': 11, 'S': 4, 'T': 0, 'H': 9, 'M': 0}","{'Y': 4, 'A': 7, 'B': 1, 'D': 0, 'E': 1, 'G': 8, 'I': 0, 'K': 8, 'L': 2, 'N': 3, 'O': 2, 'U': 4, 'V': 1, 'W': 2, 'X': 3}",FALSE,On Time
INV-ZZ-6558820,SCH-ZZ-2729891,ZZ,ZZ20240407GOIMAA4516,4516.0,Airbus A320-200,04/07/2024,2024-04-07 06:48:00,2024-04-08 02:04:00,GOI,MAA,150.0,170,113,-37,57,15,30,45,60,17,11,4,6,36,24,6,12,51,34,11,17,70,47,13,23,"{'F': 3, 'P': 3}","{'C': 9, 'J': 1, 'Z': 2}","{'Q': 9, 'R': 6, 'S': 0, 'T': 0, 'H': 2, 'M': 0}","{'Y': 1, 'A': 4, 'B': 1, 'D': 0, 'E': 1, 'G': 2, 'I': 0, 'K': 4, 'L': 1, 'N': 2, 'O': 1, 'U': 2, 'V': 1, 'W': 1, 'X': 2}",FALSE,On Time
INV-ZZ-6315776,SCH-ZZ-3820040,ZZ,ZZ20240407MAATRV2047,2047.0,Boeing 767,04/07/2024,2024-04-07 07:41:00,2024-04-08 02:50:00,MAA,TRV,278.0,308,182,-96,126,27,55,83,111,32,19,8,13,63,37,18,26,95,56,27,39,126,75,36,51,"{'F': 10, 'P': 3}","{'C': 12, 'J': 10, 'Z': 4}","{'Q': 19, 'R': 7, 'S': 0, 'T': 5, 'H': 8, 'M': 0}","{'Y': 4, 'A': 6, 'B': 3, 'D': 1, 'E': 3, 'G': 7, 'I': 0, 'K': 7, 'L': 3, 'N': 2, 'O': 4, 'U': 5, 'V': 2, 'W': 3, 'X': 1}",TRUE,On Time
INV-ZZ-2017253,SCH-ZZ-7068651,ZZ,ZZ20240407CCUHYD3723,3723.0,Boeing 787,04/07/2024,2024-04-07 16:19:00,2024-04-08 00:54:00,CCU,HYD,270.0,297,176,-94,121,27,54,81,108,30,18,9,12,60,36,18,24,94,56,25,38,127,75,33,52,"{'F': 7, 'P': 5}","{'C': 13, 'J': 4, 'Z': 7}","{'Q': 15, 'R': 10, 'S': 2, 'T': 2, 'H': 9, 'M': 0}","{'Y': 8, 'A': 6, 'B': 3, 'D': 0, 'E': 2, 'G': 5, 'I': 3, 'K': 8, 'L': 2, 'N': 1, 'O': 1, 'U': 6, 'V': 2, 'W': 1, 'X': 4}",TRUE,Cancelled
INV-ZZ-5183618,SCH-ZZ-6095474,ZZ,ZZ20240407HYDAMD3723,3723.0,Airbus A320 Neo,04/07/2024,2024-04-07 20:40:00,2024-04-08 12:24:00,HYD,AMD,180.0,201,123,-57,78,18,36,54,72,20,12,6,8,43,26,10,17,63,39,15,24,82,50,22,32,"{'F': 6, 'P': 2}","{'C': 6, 'J': 5, 'Z': 6}","{'Q': 8, 'R': 7, 'S': 0, 'T': 0, 'H': 8, 'M': 1}","{'Y': 5, 'A': 4, 'B': 2, 'D': 0, 'E': 2, 'G': 3, 'I': 1, 'K': 4, 'L': 3, 'N': 0, 'O': 0, 'U': 5, 'V': 1, 'W': 2, 'X': 0}",FALSE,On Time
INV-ZZ-4828758,SCH-ZZ-2404944,ZZ,ZZ20240407PNQGAU4614,4614.0,Airbus A320-200,04/07/2024,2024-04-07 23:31:00,2024-04-08 23:12:00,PNQ,GAU,150.0,177,116,-34,61,15,30,45,60,18,12,3,6,35,23,7,12,54,35,10,19,69,45,15,24,"{'F': 3, 'P': 3}","{'C': 9, 'J': 0, 'Z': 3}","{'Q': 9, 'R': 4, 'S': 2, 'T': 1, 'H': 3, 'M': 0}","{'Y': 1, 'A': 3, 'B': 2, 'D': 1, 'E': 2, 'G': 2, 'I': 2, 'K': 4, 'L': 1, 'N': 1, 'O': 0, 'U': 1, 'V': 0, 'W': 2, 'X': 2}",FALSE,On Time
INV-ZZ-2542418,SCH-ZZ-3750409,ZZ,ZZ20240408DELBOM4516,4516.0,Boeing 767,04/08/2024,2024-04-08 05:29:00,2024-04-08 15:51:00,DEL,BOM,278.0,323,191,-87,132,27,55,83,111,32,19,8,13,61,36,19,25,98,58,25,40,126,74,37,52,"{'F': 11, 'P': 2}","{'C': 12, 'J': 7, 'Z': 6}","{'Q': 19, 'R': 11, 'S': 1, 'T': 0, 'H': 9, 'M': 0}","{'Y': 7, 'A': 5, 'B': 2, 'D': 2, 'E': 1, 'G': 8, 'I': 3, 'K': 7, 'L': 2, 'N': 3, 'O': 3, 'U': 3, 'V': 3, 'W': 2, 'X': 1}",TRUE,Cancelled
INV-ZZ-7442576,SCH-ZZ-3820040,ZZ,ZZ20240408MAATRV2047,2047.0,Boeing 767,04/08/2024,2024-04-08 07:41:00,2024-04-09 02:50:00,MAA,TRV,278.0,315,207,-71,108,27,55,83,111,31,20,7,11,66,43,12,23,96,63,20,33,130,86,25,44,"{'F': 4, 'P': 7}","{'C': 13, 'J': 6, 'Z': 4}","{'Q': 14, 'R': 7, 'S': 0, 'T': 0, 'H': 12, 'M': 0}","{'Y': 8, 'A': 4, 'B': 0, 'D': 2, 'E': 2, 'G': 5, 'I': 1, 'K': 7, 'L': 1, 'N': 0, 'O': 3, 'U': 7, 'V': 3, 'W': 0, 'X': 1}",TRUE,On Time
INV-ZZ-6107518,SCH-ZZ-9117133,ZZ,ZZ20240408BLRCCU2504,2504.0,Boeing 777,04/08/2024,2024-04-08 15:35:00,2024-04-08 18:17:00,BLR,CCU,425.0,492,318,-107,174,42,85,127,170,48,31,11,17,95,61,24,34,146,94,33,52,189,122,48,67,"{'F': 12, 'P': 5}","{'C': 16, 'J': 11, 'Z': 7}","{'Q': 21, 'R': 12, 'S': 0, 'T': 2, 'H': 17, 'M': 0}","{'Y': 8, 'A': 11, 'B': 0, 'D': 1, 'E': 4, 'G': 9, 'I': 3, 'K': 9, 'L': 1, 'N': 1, 'O': 1, 'U': 10, 'V': 6, 'W': 0, 'X': 3}",FALSE,On Time
INV-ZZ-2471440,SCH-ZZ-6536717,ZZ,ZZ20240408GAUBOM2526,2526.0,Boeing 717,04/08/2024,2024-04-08 15:59:00,2024-04-09 05:45:00,GAU,BOM,100.0,118,76,-24,42,10,20,30,40,12,8,2,4,24,16,4,8,33,21,9,12,45,29,11,16,"{'F': 3, 'P': 1}","{'C': 6, 'J': 0, 'Z': 2}","{'Q': 6, 'R': 3, 'S': 0, 'T': 2, 'H': 0, 'M': 1}","{'Y': 1, 'A': 0, 'B': 2, 'D': 0, 'E': 0, 'G': 3, 'I': 1, 'K': 2, 'L': 0, 'N': 2, 'O': 0, 'U': 2, 'V': 1, 'W': 1, 'X': 1}",FALSE,On Time
INV-ZZ-1748690,SCH-ZZ-2693534,ZZ,ZZ20240408MAACJB4341,4341.0,Boeing 757,04/08/2024,2024-04-08 17:09:00,2024-04-08 22:11:00,MAA,CJB,209.0,235,156,-53,79,20,41,62,83,22,15,5,7,47,31,10,16,74,49,13,25,96,64,19,32,"{'F': 4, 'P': 3}","{'C': 7, 'J': 6, 'Z': 3}","{'Q': 16, 'R': 2, 'S': 3, 'T': 0, 'H': 2, 'M': 2}","{'Y': 5, 'A': 4, 'B': 0, 'D': 0, 'E': 2, 'G': 3, 'I': 0, 'K': 4, 'L': 3, 'N': 1, 'O': 1, 'U': 5, 'V': 0, 'W': 1, 'X': 3}",TRUE,On Time
INV-ZZ-6550612,SCH-ZZ-7589545,ZZ,ZZ20240409MAATRV2008,2008.0,Boeing 787,04/09/2024,2024-04-09 02:25:00,2024-04-09 21:44:00,MAA,TRV,270.0,314,196,-74,118,27,54,81,108,31,19,8,12,62,39,15,23,90,56,25,34,119,74,34,45,"{'F': 9, 'P': 3}","{'C': 12, 'J': 3, 'Z': 8}","{'Q': 14, 'R': 8, 'S': 1, 'T': 0, 'H': 9, 'M': 2}","{'Y': 5, 'A': 6, 'B': 3, 'D': 0, 'E': 2, 'G': 7, 'I': 3, 'K': 6, 'L': 1, 'N': 3, 'O': 1, 'U': 3, 'V': 2, 'W': 1, 'X': 2}",TRUE,Cancelled
INV-ZZ-1151782,SCH-ZZ-9117133,ZZ,ZZ20240409BLRCCU2504,2504.0,Boeing 777,04/09/2024,2024-04-09 15:35:00,2024-04-09 18:17:00,BLR,CCU,425.0,496,305,-120,191,42,85,127,170,46,28,14,18,100,62,23,38,141,87,40,54,192,118,52,74,"{'F': 6, 'P': 12}","{'C': 17, 'J': 12, 'Z': 9}","{'Q': 26, 'R': 14, 'S': 0, 'T': 4, 'H': 10, 'M': 0}","{'Y': 5, 'A': 10, 'B': 5, 'D': 2, 'E': 5, 'G': 9, 'I': 1, 'K': 12, 'L': 1, 'N': 5, 'O': 4, 'U': 9, 'V': 2, 'W': 1, 'X': 3}",TRUE,Cancelled
INV-ZZ-2239263,SCH-ZZ-6536717,ZZ,ZZ20240409GAUBOM2526,2526.0,Boeing 717,04/09/2024,2024-04-09 15:59:00,2024-04-10 05:45:00,GAU,BOM,100.0,118,72,-28,46,10,20,30,40,12,7,3,5,22,13,7,9,35,21,9,14,48,29,11,19,"{'F': 4, 'P': 1}","{'C': 5, 'J': 0, 'Z': 4}","{'Q': 6, 'R': 1, 'S': 1, 'T': 1, 'H': 5, 'M': 0}","{'Y': 2, 'A': 3, 'B': 1, 'D': 0, 'E': 0, 'G': 2, 'I': 1, 'K': 2, 'L': 2, 'N': 0, 'O': 2, 'U': 0, 'V': 1, 'W': 2, 'X': 1}",FALSE,On Time
INV-ZZ-7480391,SCH-ZZ-2404944,ZZ,ZZ20240409PNQGAU4614,4614.0,Airbus A320-200,04/09/2024,2024-04-09 23:31:00,2024-04-10 23:12:00,PNQ,GAU,150.0,167,96,-54,71,15,30,45,60,18,10,5,8,35,20,10,15,51,29,16,22,70,40,20,30,"{'F': 5, 'P': 3}","{'C': 4, 'J': 6, 'Z': 5}","{'Q': 10, 'R': 7, 'S': 0, 'T': 0, 'H': 5, 'M': 0}","{'Y': 4, 'A': 3, 'B': 2, 'D': 0, 'E': 1, 'G': 2, 'I': 2, 'K': 4, 'L': 2, 'N': 2, 'O': 0, 'U': 4, 'V': 1, 'W': 1, 'X': 2}",TRUE,Cancelled
INV-ZZ-9223256,SCH-ZZ-5041804,ZZ,ZZ20240409HYDCJB2880,2880.0,ATR 72,04/09/2024,2024-04-09 23:47:00,2024-04-10 13:44:00,HYD,CJB,72.0,80,50,-22,30,7,14,21,28,8,5,2,3,17,11,3,6,24,15,6,9,32,20,8,12,"{'F': 1, 'P': 2}","{'C': 4, 'J': 0, 'Z': 2}","{'Q': 3, 'R': 2, 'S': 1, 'T': 0, 'H': 3, 'M': 0}","{'Y': 1, 'A': 2, 'B': 0, 'D': 0, 'E': 1, 'G': 0, 'I': 1, 'K': 1, 'L': 1, 'N': 1, 'O': 1, 'U': 1, 'V': 1, 'W': 0, 'X': 1}",TRUE,On Time
INV-ZZ-7954823,SCH-ZZ-7589545,ZZ,ZZ20240410MAATRV2008,2008.0,Boeing 787,04/10/2024,2024-04-10 02:25:00,2024-04-10 21:44:00,MAA,TRV,270.0,316,184,-86,132,27,54,81,108,31,18,9,13,64,37,17,27,90,52,29,38,123,72,36,51,"{'F': 12, 'P': 1}","{'C': 11, 'J': 7, 'Z': 9}","{'Q': 14, 'R': 9, 'S': 1, 'T': 0, 'H': 10, 'M': 4}","{'Y': 8, 'A': 2, 'B': 4, 'D': 2, 'E': 2, 'G': 5, 'I': 4, 'K': 7, 'L': 1, 'N': 4, 'O': 2, 'U': 7, 'V': 0, 'W': 3, 'X': 0}",TRUE,Cancelled
INV-ZZ-4154672,SCH-ZZ-2729891,ZZ,ZZ20240410GOIMAA4516,4516.0,Airbus A320-200,04/10/2024,2024-04-10 06:48:00,2024-04-11 02:04:00,GOI,MAA,150.0,170,107,-43,63,15,30,45,60,17,11,4,6,35,22,8,13,54,34,11,20,66,41,19,25,"{'F': 5, 'P': 1}","{'C': 8, 'J': 3, 'Z': 2}","{'Q': 8, 'R': 4, 'S': 0, 'T': 3, 'H': 4, 'M': 1}","{'Y': 4, 'A': 2, 'B': 1, 'D': 0, 'E': 2, 'G': 2, 'I': 1, 'K': 4, 'L': 2, 'N': 2, 'O': 0, 'U': 3, 'V': 0, 'W': 1, 'X': 1}",FALSE,On Time
INV-ZZ-2312764,SCH-ZZ-9117133,ZZ,ZZ20240410BLRCCU2504,2504.0,Boeing 777,04/10/2024,2024-04-10 15:35:00,2024-04-10 18:17:00,BLR,CCU,425.0,504,298,-127,206,42,85,127,170,49,29,13,20,94,56,29,38,141,83,44,58,190,113,57,77,"{'F': 16, 'P': 4}","{'C': 17, 'J': 10, 'Z': 11}","{'Q': 31, 'R': 11, 'S': 2, 'T': 4, 'H': 10, 'M': 0}","{'Y': 10, 'A': 9, 'B': 5, 'D': 3, 'E': 4, 'G': 12, 'I': 1, 'K': 11, 'L': 3, 'N': 2, 'O': 2, 'U': 7, 'V': 2, 'W': 4, 'X': 2}",FALSE,On Time
INV-ZZ-9584146,SCH-ZZ-2312688,ZZ,ZZ20240410MAATRV4122,4122.0,Boeing 787,04/10/2024,2024-04-10 19:54:00,2024-04-11 02:05:00,MAA,TRV,270.0,322,196,-74,126,27,54,81,108,31,19,8,12,61,37,17,24,96,58,23,38,121,74,34,47,"{'F': 9, 'P': 3}","{'C': 11, 'J': 6, 'Z': 7}","{'Q': 15, 'R': 8, 'S': 0, 'T': 2, 'H': 12, 'M': 1}","{'Y': 5, 'A': 4, 'B': 1, 'D': 2, 'E': 3, 'G': 8, 'I': 3, 'K': 5, 'L': 3, 'N': 3, 'O': 2, 'U': 2, 'V': 0, 'W': 2, 'X': 4}",TRUE,On Time
INV-ZZ-8561943,SCH-ZZ-6095474,ZZ,ZZ20240410HYDAMD3723,3723.0,Airbus A320 Neo,04/10/2024,2024-04-10 20:40:00,2024-04-11 12:24:00,HYD,AMD,180.0,202,131,-49,71,18,36,54,72,21,14,4,7,43,28,8,15,64,41,13,23,82,53,19,29,"{'F': 5, 'P': 2}","{'C': 7, 'J': 0, 'Z': 8}","{'Q': 9, 'R': 6, 'S': 0, 'T': 0, 'H': 8, 'M': 0}","{'Y': 1, 'A': 3, 'B': 2, 'D': 0, 'E': 2, 'G': 5, 'I': 1, 'K': 5, 'L': 0, 'N': 1, 'O': 0, 'U': 3, 'V': 3, 'W': 1, 'X': 2}",TRUE,On Time
INV-ZZ-1586845,SCH-ZZ-6980436,ZZ,ZZ20240410BOMBLR3556,3556.0,Boeing 777,04/10/2024,2024-04-10 22:10:00,2024-04-11 05:46:00,BOM,BLR,425.0,472,296,-129,176,42,85,127,170,50,31,11,19,95,59,26,36,145,91,36,54,192,120,50,72,"{'F': 11, 'P': 8}","{'C': 20, 'J': 4, 'Z': 12}","{'Q': 22, 'R': 9, 'S': 3, 'T': 3, 'H': 12, 'M': 5}","{'Y': 8, 'A': 9, 'B': 2, 'D': 2, 'E': 1, 'G': 12, 'I': 1, 'K': 10, 'L': 3, 'N': 3, 'O': 5, 'U': 7, 'V': 3, 'W': 3, 'X': 3}",FALSE,On Time
INV-ZZ-5828272,SCH-ZZ-2404944,ZZ,ZZ20240410PNQGAU4614,4614.0,Airbus A320-200,04/10/2024,2024-04-10 23:31:00,2024-04-11 23:12:00,PNQ,GAU,150.0,177,116,-34,61,15,30,45,60,17,11,4,6,34,22,8,12,50,33,12,17,69,45,15,24,"{'F': 4, 'P': 2}","{'C': 7, 'J': 1, 'Z': 4}","{'Q': 10, 'R': 4, 'S': 0, 'T': 0, 'H': 2, 'M': 1}","{'Y': 4, 'A': 3, 'B': 2, 'D': 0, 'E': 1, 'G': 3, 'I': 1, 'K': 3, 'L': 0, 'N': 1, 'O': 2, 'U': 2, 'V': 0, 'W': 1, 'X': 1}",TRUE,On Time
INV-ZZ-4205297,SCH-ZZ-5041804,ZZ,ZZ20240410HYDCJB2880,2880.0,ATR 72,04/10/2024,2024-04-10 23:47:00,2024-04-11 13:44:00,HYD,CJB,72.0,84,52,-20,32,7,14,21,28,8,5,2,3,16,10,4,6,25,16,5,9,33,20,8,13,"{'F': 3, 'P': 0}","{'C': 5, 'J': 0, 'Z': 1}","{'Q': 4, 'R': 4, 'S': 0, 'T': 0, 'H': 1, 'M': 0}","{'Y': 1, 'A': 2, 'B': 1, 'D': 0, 'E': 1, 'G': 1, 'I': 1, 'K': 2, 'L': 0, 'N': 0, 'O': 1, 'U': 2, 'V': 0, 'W': 0, 'X': 1}",TRUE,On Time
INV-ZZ-7863792,SCH-ZZ-7589545,ZZ,ZZ20240411MAATRV2008,2008.0,Boeing 787,04/11/2024,2024-04-11 02:25:00,2024-04-11 21:44:00,MAA,TRV,270.0,298,180,-90,118,27,54,81,108,31,19,8,12,60,36,18,24,90,55,26,35,121,73,35,48,"{'F': 10, 'P': 2}","{'C': 9, 'J': 9, 'Z': 6}","{'Q': 16, 'R': 8, 'S': 1, 'T': 0, 'H': 10, 'M': 0}","{'Y': 6, 'A': 6, 'B': 2, 'D': 3, 'E': 3, 'G': 4, 'I': 4, 'K': 6, 'L': 1, 'N': 2, 'O': 3, 'U': 6, 'V': 1, 'W': 1, 'X': 0}",TRUE,On Time
INV-ZZ-2929384,SCH-ZZ-2729891,ZZ,ZZ20240411GOIMAA4516,4516.0,Airbus A320-200,04/11/2024,2024-04-11 06:48:00,2024-04-12 02:04:00,GOI,MAA,150.0,173,100,-50,73,15,30,45,60,17,10,5,7,34,20,10,14,50,29,16,21,71,41,19,30,"{'F': 6, 'P': 1}","{'C': 7, 'J': 1, 'Z': 6}","{'Q': 10, 'R': 5, 'S': 0, 'T': 1, 'H': 3, 'M': 2}","{'Y': 3, 'A': 4, 'B': 2, 'D': 1, 'E': 1, 'G': 2, 'I': 2, 'K': 4, 'L': 2, 'N': 2, 'O': 0, 'U': 1, 'V': 2, 'W': 2, 'X': 2}",FALSE,On Time
INV-ZZ-3345831,SCH-ZZ-9117133,ZZ,ZZ20240411BLRCCU2504,2504.0,Boeing 777,04/11/2024,2024-04-11 15:35:00,2024-04-11 18:17:00,BLR,CCU,425.0,473,310,-115,163,42,85,127,170,49,32,10,17,97,64,21,33,151,99,28,52,197,129,41,68,"{'F': 13, 'P': 4}","{'C': 14, 'J': 17, 'Z': 2}","{'Q': 24, 'R': 11, 'S': 0, 'T': 2, 'H': 15, 'M': 0}","{'Y': 10, 'A': 10, 'B': 0, 'D': 4, 'E': 0, 'G': 7, 'I': 2, 'K': 8, 'L': 4, 'N': 3, 'O': 2, 'U': 10, 'V': 3, 'W': 4, 'X': 1}",TRUE,On Time
INV-ZZ-4864835,SCH-ZZ-7068651,ZZ,ZZ20240411CCUHYD3723,3723.0,Boeing 787,04/11/2024,2024-04-11 16:19:00,2024-04-12 00:54:00,CCU,HYD,270.0,317,187,-83,130,27,54,81,108,32,19,8,13,64,38,16,26,90,53,28,37,121,71,37,50,"{'F': 8, 'P': 5}","{'C': 14, 'J': 8, 'Z': 4}","{'Q': 19, 'R': 11, 'S': 1, 'T': 0, 'H': 6, 'M': 0}","{'Y': 5, 'A': 4, 'B': 3, 'D': 2, 'E': 1, 'G': 4, 'I': 3, 'K': 6, 'L': 2, 'N': 3, 'O': 3, 'U': 3, 'V': 4, 'W': 4, 'X': 3}",TRUE,On Time
INV-ZZ-1703048,SCH-ZZ-6095474,ZZ,ZZ20240411HYDAMD3723,3723.0,Airbus A320 Neo,04/11/2024,2024-04-11 20:40:00,2024-04-12 12:24:00,HYD,AMD,180.0,206,118,-62,88,18,36,54,72,20,11,7,9,43,25,11,18,63,36,18,27,82,47,25,35,"{'F': 6, 'P': 3}","{'C': 9, 'J': 2, 'Z': 7}","{'Q': 12, 'R': 2, 'S': 3, 'T': 0, 'H': 10, 'M': 0}","{'Y': 4, 'A': 5, 'B': 3, 'D': 2, 'E': 2, 'G': 3, 'I': 0, 'K': 1, 'L': 0, 'N': 2, 'O': 1, 'U': 4, 'V': 2, 'W': 3, 'X': 3}",FALSE,On Time
INV-ZZ-9604342,SCH-ZZ-2404944,ZZ,ZZ20240411PNQGAU4614,4614.0,Airbus A320-200,04/11/2024,2024-04-11 23:31:00,2024-04-12 23:12:00,PNQ,GAU,150.0,166,98,-52,68,15,30,45,60,18,11,4,7,34,20,10,14,50,30,15,20,72,43,17,29,"{'F': 6, 'P': 1}","{'C': 7, 'J': 6, 'Z': 1}","{'Q': 12, 'R': 4, 'S': 0, 'T': 0, 'H': 3, 'M': 1}","{'Y': 1, 'A': 2, 'B': 2, 'D': 2, 'E': 1, 'G': 2, 'I': 1, 'K': 4, 'L': 1, 'N': 2, 'O': 2, 'U': 4, 'V': 1, 'W': 2, 'X': 2}",FALSE,On Time
INV-ZZ-7294072,SCH-ZZ-5041804,ZZ,ZZ20240411HYDCJB2880,2880.0,ATR 72,04/11/2024,2024-04-11 23:47:00,2024-04-12 13:44:00,HYD,CJB,72.0,81,53,-19,28,7,14,21,28,8,5,2,3,16,10,4,6,25,16,5,9,32,21,7,11,"{'F': 3, 'P': 0}","{'C': 1, 'J': 4, 'Z': 1}","{'Q': 4, 'R': 1, 'S': 0, 'T': 0, 'H': 3, 'M': 1}","{'Y': 0, 'A': 2, 'B': 0, 'D': 0, 'E': 1, 'G': 2, 'I': 1, 'K': 0, 'L': 0, 'N': 1, 'O': 1, 'U': 2, 'V': 1, 'W': 0, 'X': 0}",TRUE,On Time
INV-ZZ-6222897,SCH-ZZ-3930555,ZZ,ZZ20240412JAILKO4478,4478.0,Airbus A321-200,04/12/2024,2024-04-12 01:47:00,2024-04-12 19:45:00,JAI,LKO,200.0,220,141,-59,79,20,40,60,80,23,15,5,8,47,30,10,17,67,43,17,24,93,60,20,33,"{'F': 5, 'P': 3}","{'C': 8, 'J': 4, 'Z': 5}","{'Q': 10, 'R': 3, 'S': 1, 'T': 2, 'H': 7, 'M': 1}","{'Y': 2, 'A': 6, 'B': 2, 'D': 1, 'E': 1, 'G': 1, 'I': 3, 'K': 3, 'L': 1, 'N': 1, 'O': 1, 'U': 5, 'V': 3, 'W': 0, 'X': 3}",FALSE,On Time
INV-ZZ-2926226,SCH-ZZ-4843596,ZZ,ZZ20240412AMDBLR3041,3041.0,Airbus A321-200,04/12/2024,2024-04-12 14:26:00,2024-04-12 18:12:00,AMD,BLR,200.0,239,148,-52,91,20,40,60,80,22,14,6,8,48,30,10,18,66,41,19,25,92,57,23,35,"{'F': 8, 'P': 0}","{'C': 6, 'J': 4, 'Z': 8}","{'Q': 11, 'R': 4, 'S': 0, 'T': 0, 'H': 10, 'M': 0}","{'Y': 5, 'A': 6, 'B': 2, 'D': 1, 'E': 1, 'G': 5, 'I': 0, 'K': 3, 'L': 0, 'N': 2, 'O': 2, 'U': 4, 'V': 3, 'W': 0, 'X': 1}",FALSE,On Time
INV-ZZ-3255905,SCH-ZZ-6536717,ZZ,ZZ20240412GAUBOM2526,2526.0,Boeing 717,04/12/2024,2024-04-12 15:59:00,2024-04-13 05:45:00,GAU,BOM,100.0,113,73,-27,40,10,20,30,40,12,8,2,4,24,16,4,8,34,22,8,12,47,31,9,16,"{'F': 3, 'P': 1}","{'C': 3, 'J': 1, 'Z': 4}","{'Q': 3, 'R': 5, 'S': 0, 'T': 1, 'H': 2, 'M': 1}","{'Y': 1, 'A': 0, 'B': 1, 'D': 0, 'E': 1, 'G': 2, 'I': 2, 'K': 1, 'L': 2, 'N': 0, 'O': 2, 'U': 2, 'V': 0, 'W': 2, 'X': 0}",FALSE,On Time
INV-ZZ-4306317,SCH-ZZ-4269181,ZZ,ZZ20240412MAACJB2885,2885.0,Boeing 777,04/12/2024,2024-04-12 17:43:00,2024-04-13 09:14:00,MAA,CJB,425.0,507,330,-95,177,42,85,127,170,47,31,11,16,101,66,19,35,150,97,30,53,193,125,45,68,"{'F': 14, 'P': 2}","{'C': 16, 'J': 17, 'Z': 2}","{'Q': 25, 'R': 13, 'S': 0, 'T': 2, 'H': 13, 'M': 0}","{'Y': 10, 'A': 6, 'B': 1, 'D': 3, 'E': 0, 'G': 12, 'I': 3, 'K': 10, 'L': 3, 'N': 0, 'O': 5, 'U': 11, 'V': 2, 'W': 0, 'X': 2}",TRUE,On Time
INV-ZZ-5293019,SCH-ZZ-2312688,ZZ,ZZ20240412MAATRV4122,4122.0,Boeing 787,04/12/2024,2024-04-12 19:54:00,2024-04-13 02:05:00,MAA,TRV,270.0,314,188,-82,126,27,54,81,108,32,19,8,13,61,37,17,24,97,58,23,39,125,75,33,50,"{'F': 12, 'P': 1}","{'C': 15, 'J': 1, 'Z': 8}","{'Q': 17, 'R': 8, 'S': 2, 'T': 3, 'H': 8, 'M': 1}","{'Y': 7, 'A': 5, 'B': 4, 'D': 3, 'E': 1, 'G': 5, 'I': 4, 'K': 4, 'L': 4, 'N': 1, 'O': 1, 'U': 5, 'V': 4, 'W': 2, 'X': 0}",TRUE,On Time
INV-ZZ-5354827,SCH-ZZ-6980436,ZZ,ZZ20240412BOMBLR3556,3556.0,Boeing 777,04/12/2024,2024-04-12 22:10:00,2024-04-13 05:46:00,BOM,BLR,425.0,498,318,-107,180,42,85,127,170,50,32,10,18,95,61,24,34,144,92,35,52,204,130,40,74,"{'F': 12, 'P': 6}","{'C': 16, 'J': 12, 'Z': 6}","{'Q': 21, 'R': 5, 'S': 2, 'T': 7, 'H': 13, 'M': 4}","{'Y': 9, 'A': 10, 'B': 4, 'D': 3, 'E': 0, 'G': 8, 'I': 4, 'K': 9, 'L': 3, 'N': 5, 'O': 0, 'U': 12, 'V': 2, 'W': 2, 'X': 3}",FALSE,On Time
INV-ZZ-8927770,SCH-ZZ-7589545,ZZ,ZZ20240413MAATRV2008,2008.0,Boeing 787,04/13/2024,2024-04-13 02:25:00,2024-04-13 21:44:00,MAA,TRV,270.0,315,191,-79,124,27,54,81,108,32,19,8,13,59,36,18,23,91,55,26,36,124,75,33,49,"{'F': 9, 'P': 4}","{'C': 10, 'J': 4, 'Z': 9}","{'Q': 18, 'R': 6, 'S': 1, 'T': 0, 'H': 11, 'M': 0}","{'Y': 8, 'A': 4, 'B': 2, 'D': 2, 'E': 0, 'G': 6, 'I': 3, 'K': 4, 'L': 0, 'N': 3, 'O': 3, 'U': 8, 'V': 2, 'W': 4, 'X': 0}",TRUE,On Time
INV-ZZ-1832976,SCH-ZZ-6544056,ZZ,ZZ20240413BOMDEL3869,3869.0,BAe 146,04/13/2024,2024-04-13 07:20:00,2024-04-13 09:24:00,BOM,DEL,91.0,103,65,-26,38,9,18,27,36,10,6,3,4,20,13,5,7,30,19,8,11,43,27,9,16,"{'F': 4, 'P': 0}","{'C': 1, 'J': 2, 'Z': 4}","{'Q': 4, 'R': 2, 'S': 0, 'T': 3, 'H': 2, 'M': 0}","{'Y': 3, 'A': 2, 'B': 0, 'D': 1, 'E': 1, 'G': 3, 'I': 1, 'K': 1, 'L': 1, 'N': 0, 'O': 1, 'U': 0, 'V': 0, 'W': 1, 'X': 1}",FALSE,On Time
INV-ZZ-8273413,SCH-ZZ-3820040,ZZ,ZZ20240413MAATRV2047,2047.0,Boeing 767,04/13/2024,2024-04-13 07:41:00,2024-04-14 02:50:00,MAA,TRV,278.0,314,193,-85,121,27,55,83,111,31,19,8,12,63,39,16,24,96,59,24,37,128,78,33,50,"{'F': 6, 'P': 6}","{'C': 11, 'J': 7, 'Z': 6}","{'Q': 20, 'R': 9, 'S': 0, 'T': 1, 'H': 7, 'M': 0}","{'Y': 5, 'A': 8, 'B': 2, 'D': 0, 'E': 0, 'G': 7, 'I': 0, 'K': 7, 'L': 4, 'N': 3, 'O': 2, 'U': 5, 'V': 3, 'W': 1, 'X': 3}",TRUE,On Time
INV-ZZ-9936496,SCH-ZZ-3249150,ZZ,ZZ20240413BOMAMD4704,4704.0,BAe 146,04/13/2024,2024-04-13 13:45:00,2024-04-13 19:31:00,BOM,AMD,91.0,102,62,-29,40,9,18,27,36,11,7,2,4,21,13,5,8,31,19,8,12,41,25,11,16,"{'F': 4, 'P': 0}","{'C': 4, 'J': 4, 'Z': 0}","{'Q': 6, 'R': 4, 'S': 0, 'T': 0, 'H': 2, 'M': 0}","{'Y': 3, 'A': 3, 'B': 1, 'D': 1, 'E': 1, 'G': 0, 'I': 1, 'K': 3, 'L': 0, 'N': 0, 'O': 0, 'U': 1, 'V': 0, 'W': 1, 'X': 1}",FALSE,On Time
INV-ZZ-4078402,SCH-ZZ-7068651,ZZ,ZZ20240413CCUHYD3723,3723.0,Boeing 787,04/13/2024,2024-04-13 16:19:00,2024-04-14 00:54:00,CCU,HYD,270.0,297,186,-84,111,27,54,81,108,32,20,7,12,63,39,15,24,93,58,23,35,122,76,32,46,"{'F': 7, 'P': 5}","{'C': 12, 'J': 4, 'Z': 8}","{'Q': 19, 'R': 5, 'S': 3, 'T': 0, 'H': 7, 'M': 1}","{'Y': 5, 'A': 6, 'B': 2, 'D': 3, 'E': 2, 'G': 5, 'I': 1, 'K': 6, 'L': 3, 'N': 0, 'O': 1, 'U': 7, 'V': 2, 'W': 0, 'X': 3}",TRUE,On Time
INV-ZZ-4858723,SCH-ZZ-2312688,ZZ,ZZ20240413MAATRV4122,4122.0,Boeing 787,04/13/2024,2024-04-13 19:54:00,2024-04-14 02:05:00,MAA,TRV,270.0,303,186,-84,117,27,54,81,108,30,18,9,12,64,39,15,25,96,59,22,37,127,78,30,49,"{'F': 7, 'P': 5}","{'C': 10, 'J': 9, 'Z': 6}","{'Q': 17, 'R': 10, 'S': 0, 'T': 0, 'H': 9, 'M': 1}","{'Y': 6, 'A': 7, 'B': 2, 'D': 0, 'E': 4, 'G': 5, 'I': 3, 'K': 8, 'L': 0, 'N': 2, 'O': 2, 'U': 5, 'V': 2, 'W': 3, 'X': 0}",TRUE,On Time
INV-ZZ-1835306,SCH-ZZ-6095474,ZZ,ZZ20240413HYDAMD3723,3723.0,Airbus A320 Neo,04/13/2024,2024-04-13 20:40:00,2024-04-14 12:24:00,HYD,AMD,180.0,202,121,-59,81,18,36,54,72,20,12,6,8,40,24,12,16,60,36,18,24,81,49,23,32,"{'F': 8, 'P': 0}","{'C': 4, 'J': 10, 'Z': 2}","{'Q': 8, 'R': 7, 'S': 0, 'T': 2, 'H': 7, 'M': 0}","{'Y': 2, 'A': 5, 'B': 2, 'D': 1, 'E': 2, 'G': 0, 'I': 0, 'K': 4, 'L': 2, 'N': 2, 'O': 1, 'U': 4, 'V': 3, 'W': 3, 'X': 1}",FALSE,On Time
INV-ZZ-6384369,SCH-ZZ-7589545,ZZ,ZZ20240414MAATRV2008,2008.0,Boeing 787,04/14/2024,2024-04-14 02:25:00,2024-04-14 21:44:00,MAA,TRV,270.0,306,197,-73,109,27,54,81,108,31,20,7,11,61,39,15,22,92,59,22,33,119,77,31,42,"{'F': 8, 'P': 3}","{'C': 12, 'J': 2, 'Z': 8}","{'Q': 18, 'R': 6, 'S': 0, 'T': 2, 'H': 6, 'M': 1}","{'Y': 6, 'A': 6, 'B': 0, 'D': 3, 'E': 0, 'G': 6, 'I': 1, 'K': 7, 'L': 0, 'N': 0, 'O': 3, 'U': 6, 'V': 0, 'W': 4, 'X': 0}",TRUE,On Time
INV-ZZ-3130158,SCH-ZZ-3750409,ZZ,ZZ20240414DELBOM4516,4516.0,Boeing 767,04/14/2024,2024-04-14 05:29:00,2024-04-14 15:51:00,DEL,BOM,278.0,317,183,-95,134,27,55,83,111,32,18,9,14,64,37,18,27,95,55,28,40,130,75,36,55,"{'F': 5, 'P': 9}","{'C': 12, 'J': 7, 'Z': 8}","{'Q': 17, 'R': 8, 'S': 3, 'T': 0, 'H': 11, 'M': 1}","{'Y': 7, 'A': 7, 'B': 2, 'D': 4, 'E': 4, 'G': 7, 'I': 2, 'K': 8, 'L': 1, 'N': 0, 'O': 3, 'U': 3, 'V': 2, 'W': 2, 'X': 3}",TRUE,On Time
INV-ZZ-6218276,SCH-ZZ-3838342,ZZ,ZZ20240414HYDCCU3772,3772.0,Boeing 767,04/14/2024,2024-04-14 05:58:00,2024-04-15 03:23:00,HYD,CCU,278.0,320,197,-81,123,27,55,83,111,30,18,9,12,61,37,18,24,93,57,26,36,125,77,34,48,"{'F': 6, 'P': 6}","{'C': 7, 'J': 10, 'Z': 7}","{'Q': 20, 'R': 8, 'S': 0, 'T': 2, 'H': 6, 'M': 0}","{'Y': 7, 'A': 6, 'B': 0, 'D': 2, 'E': 4, 'G': 6, 'I': 3, 'K': 5, 'L': 1, 'N': 2, 'O': 0, 'U': 5, 'V': 4, 'W': 1, 'X': 2}",TRUE,On Time
INV-ZZ-8739157,SCH-ZZ-2729891,ZZ,ZZ20240414GOIMAA4516,4516.0,Airbus A320-200,04/14/2024,2024-04-14 06:48:00,2024-04-15 02:04:00,GOI,MAA,150.0,179,110,-40,69,15,30,45,60,18,11,4,7,35,21,9,14,52,32,13,20,68,42,18,26,"{'F': 6, 'P': 1}","{'C': 4, 'J': 5, 'Z': 5}","{'Q': 11, 'R': 3, 'S': 0, 'T': 0, 'H': 4, 'M': 2}","{'Y': 4, 'A': 4, 'B': 0, 'D': 2, 'E': 1, 'G': 3, 'I': 1, 'K': 3, 'L': 2, 'N': 0, 'O': 1, 'U': 3, 'V': 0, 'W': 0, 'X': 2}",FALSE,On Time
INV-ZZ-2549156,SCH-ZZ-3820040,ZZ,ZZ20240414MAATRV2047,2047.0,Boeing 767,04/14/2024,2024-04-14 07:41:00,2024-04-15 02:50:00,MAA,TRV,278.0,321,186,-92,135,27,55,83,111,31,18,9,13,63,37,18,26,94,55,28,39,133,77,34,56,"{'F': 7, 'P': 6}","{'C': 9, 'J': 4, 'Z': 13}","{'Q': 17, 'R': 10, 'S': 2, 'T': 1, 'H': 9, 'M': 0}","{'Y': 6, 'A': 7, 'B': 3, 'D': 1, 'E': 3, 'G': 7, 'I': 1, 'K': 7, 'L': 3, 'N': 1, 'O': 2, 'U': 8, 'V': 2, 'W': 3, 'X': 2}",TRUE,On Time
INV-ZZ-8869205,SCH-ZZ-3249150,ZZ,ZZ20240414BOMAMD4704,4704.0,BAe 146,04/14/2024,2024-04-14 13:45:00,2024-04-14 19:31:00,BOM,AMD,91.0,101,63,-28,38,9,18,27,36,10,6,3,4,21,13,5,8,30,19,8,11,41,25,11,16,"{'F': 2, 'P': 2}","{'C': 3, 'J': 2, 'Z': 3}","{'Q': 4, 'R': 3, 'S': 1, 'T': 0, 'H': 3, 'M': 0}","{'Y': 2, 'A': 3, 'B': 0, 'D': 0, 'E': 0, 'G': 3, 'I': 0, 'K': 2, 'L': 0, 'N': 1, 'O': 1, 'U': 3, 'V': 0, 'W': 1, 'X': 0}",TRUE,On Time
INV-ZZ-4393457,SCH-ZZ-4843596,ZZ,ZZ20240414AMDBLR3041,3041.0,Airbus A321-200,04/14/2024,2024-04-14 14:26:00,2024-04-14 18:12:00,AMD,BLR,200.0,235,136,-64,99,20,40,60,80,23,13,7,10,46,27,13,19,72,42,18,30,88,51,29,37,"{'F': 7, 'P': 3}","{'C': 10, 'J': 4, 'Z': 5}","{'Q': 13, 'R': 7, 'S': 3, 'T': 2, 'H': 5, 'M': 0}","{'Y': 5, 'A': 1, 'B': 1, 'D': 0, 'E': 2, 'G': 6, 'I': 3, 'K': 6, 'L': 3, 'N': 0, 'O': 3, 'U': 6, 'V': 0, 'W': 0, 'X': 1}",FALSE,On Time
INV-ZZ-5095224,SCH-ZZ-9748991,ZZ,ZZ20240414MAABOM3117,3117.0,ATR 72,04/14/2024,2024-04-14 15:49:00,2024-04-14 21:43:00,MAA,BOM,72.0,81,49,-23,32,7,14,21,28,8,5,2,3,16,10,4,6,24,15,6,9,31,19,9,12,"{'F': 1, 'P': 2}","{'C': 4, 'J': 2, 'Z': 0}","{'Q': 1, 'R': 3, 'S': 1, 'T': 2, 'H': 2, 'M': 0}","{'Y': 1, 'A': 1, 'B': 1, 'D': 0, 'E': 1, 'G': 2, 'I': 1, 'K': 1, 'L': 0, 'N': 0, 'O': 0, 'U': 2, 'V': 1, 'W': 0, 'X': 1}",TRUE,On Time
INV-ZZ-5186934,SCH-ZZ-7068651,ZZ,ZZ20240414CCUHYD3723,3723.0,Boeing 787,04/14/2024,2024-04-14 16:19:00,2024-04-15 00:54:00,CCU,HYD,270.0,322,182,-88,140,27,54,81,108,30,17,10,13,62,35,19,27,97,55,26,42,126,71,37,55,"{'F': 9, 'P': 4}","{'C': 8, 'J': 10, 'Z': 9}","{'Q': 15, 'R': 11, 'S': 1, 'T': 4, 'H': 9, 'M': 2}","{'Y': 6, 'A': 7, 'B': 3, 'D': 3, 'E': 2, 'G': 8, 'I': 4, 'K': 7, 'L': 2, 'N': 0, 'O': 2, 'U': 5, 'V': 2, 'W': 3, 'X': 1}",TRUE,On Time
INV-ZZ-8897340,SCH-ZZ-4269181,ZZ,ZZ20240414MAACJB2885,2885.0,Boeing 777,04/14/2024,2024-04-14 17:43:00,2024-04-15 09:14:00,MAA,CJB,425.0,493,292,-133,201,42,85,127,170,49,29,13,20,99,59,26,40,146,86,41,60,191,113,57,78,"{'F': 13, 'P': 7}","{'C': 18, 'J': 7, 'Z': 15}","{'Q': 31, 'R': 8, 'S': 2, 'T': 0, 'H': 19, 'M': 0}","{'Y': 11, 'A': 10, 'B': 3, 'D': 2, 'E': 0, 'G': 12, 'I': 1, 'K': 10, 'L': 1, 'N': 5, 'O': 3, 'U': 10, 'V': 1, 'W': 4, 'X': 5}",FALSE,On Time
INV-ZZ-1644109,SCH-ZZ-6095474,ZZ,ZZ20240414HYDAMD3723,3723.0,Airbus A320 Neo,04/14/2024,2024-04-14 20:40:00,2024-04-15 12:24:00,HYD,AMD,180.0,201,124,-56,77,18,36,54,72,21,13,5,8,42,26,10,16,63,39,15,24,81,50,22,31,"{'F': 6, 'P': 2}","{'C': 10, 'J': 2, 'Z': 4}","{'Q': 10, 'R': 7, 'S': 0, 'T': 0, 'H': 4, 'M': 3}","{'Y': 5, 'A': 3, 'B': 3, 'D': 0, 'E': 1, 'G': 2, 'I': 0, 'K': 5, 'L': 0, 'N': 2, 'O': 1, 'U': 5, 'V': 0, 'W': 3, 'X': 1}",TRUE,On Time
INV-ZZ-1008156,SCH-ZZ-2404944,ZZ,ZZ20240414PNQGAU4614,4614.0,Airbus A320-200,04/14/2024,2024-04-14 23:31:00,2024-04-15 23:12:00,PNQ,GAU,150.0,178,115,-35,63,15,30,45,60,18,12,3,6,35,23,7,12,53,34,11,19,72,47,13,25,"{'F': 6, 'P': 0}","{'C': 8, 'J': 4, 'Z': 0}","{'Q': 9, 'R': 6, 'S': 0, 'T': 0, 'H': 4, 'M': 0}","{'Y': 3, 'A': 3, 'B': 2, 'D': 2, 'E': 0, 'G': 1, 'I': 2, 'K': 2, 'L': 0, 'N': 1, 'O': 0, 'U': 3, 'V': 2, 'W': 2, 'X': 2}",FALSE,On Time
INV-ZZ-8631094,SCH-ZZ-5041804,ZZ,ZZ20240414HYDCJB2880,2880.0,ATR 72,04/14/2024,2024-04-14 23:47:00,2024-04-15 13:44:00,HYD,CJB,72.0,81,45,-27,36,7,14,21,28,8,4,3,4,17,10,4,7,24,13,8,11,33,18,10,15,"{'F': 2, 'P': 2}","{'C': 3, 'J': 2, 'Z': 2}","{'Q': 3, 'R': 3, 'S': 2, 'T': 0, 'H': 2, 'M': 1}","{'Y': 1, 'A': 2, 'B': 1, 'D': 1, 'E': 1, 'G': 1, 'I': 1, 'K': 2, 'L': 0, 'N': 1, 'O': 1, 'U': 1, 'V': 1, 'W': 0, 'X': 1}",TRUE,On Time
INV-ZZ-6428032,SCH-ZZ-3930555,ZZ,ZZ20240415JAILKO4478,4478.0,Airbus A321-200,04/15/2024,2024-04-15 01:47:00,2024-04-15 19:45:00,JAI,LKO,200.0,238,144,-56,94,20,40,60,80,24,15,5,9,47,28,12,19,72,44,16,28,93,56,24,37,"{'F': 6, 'P': 3}","{'C': 5, 'J': 6, 'Z': 8}","{'Q': 12, 'R': 4, 'S': 0, 'T': 3, 'H': 6, 'M': 3}","{'Y': 4, 'A': 5, 'B': 1, 'D': 1, 'E': 0, 'G': 4, 'I': 2, 'K': 3, 'L': 3, 'N': 3, 'O': 1, 'U': 4, 'V': 3, 'W': 2, 'X': 1}",FALSE,On Time
INV-ZZ-7298975,SCH-ZZ-3750409,ZZ,ZZ20240415DELBOM4516,4516.0,Boeing 767,04/15/2024,2024-04-15 05:29:00,2024-04-15 15:51:00,DEL,BOM,278.0,306,171,-107,135,27,55,83,111,32,18,9,14,62,35,20,27,99,55,28,44,131,73,38,58,"{'F': 10, 'P': 4}","{'C': 11, 'J': 10, 'Z': 6}","{'Q': 16, 'R': 10, 'S': 5, 'T': 0, 'H': 10, 'M': 3}","{'Y': 8, 'A': 7, 'B': 1, 'D': 3, 'E': 2, 'G': 7, 'I': 2, 'K': 5, 'L': 3, 'N': 2, 'O': 3, 'U': 6, 'V': 4, 'W': 2, 'X': 3}",TRUE,On Time
INV-ZZ-8737965,SCH-ZZ-6544056,ZZ,ZZ20240415BOMDEL3869,3869.0,BAe 146,04/15/2024,2024-04-15 07:20:00,2024-04-15 09:24:00,BOM,DEL,91.0,108,60,-31,48,9,18,27,36,10,6,3,4,21,12,6,9,31,17,10,14,41,23,13,18,"{'F': 2, 'P': 2}","{'C': 6, 'J': 3, 'Z': 0}","{'Q': 6, 'R': 4, 'S': 0, 'T': 1, 'H': 2, 'M': 1}","{'Y': 2, 'A': 2, 'B': 1, 'D': 0, 'E': 1, 'G': 2, 'I': 1, 'K': 3, 'L': 1, 'N': 0, 'O': 0, 'U': 2, 'V': 1, 'W': 1, 'X': 1}",TRUE,On Time
INV-ZZ-4281931,SCH-ZZ-3820040,ZZ,ZZ20240415MAATRV2047,2047.0,Boeing 767,04/15/2024,2024-04-15 07:41:00,2024-04-16 02:50:00,MAA,TRV,278.0,322,202,-76,120,27,55,83,111,32,20,7,12,65,41,14,24,91,57,26,34,127,80,31,47,"{'F': 5, 'P': 7}","{'C': 13, 'J': 6, 'Z': 5}","{'Q': 19, 'R': 8, 'S': 0, 'T': 0, 'H': 7, 'M': 0}","{'Y': 4, 'A': 8, 'B': 0, 'D': 3, 'E': 1, 'G': 6, 'I': 3, 'K': 6, 'L': 0, 'N': 2, 'O': 0, 'U': 7, 'V': 4, 'W': 0, 'X': 3}",TRUE,On Time
INV-ZZ-6029799,SCH-ZZ-3249150,ZZ,ZZ20240415BOMAMD4704,4704.0,BAe 146,04/15/2024,2024-04-15 13:45:00,2024-04-15 19:31:00,BOM,AMD,91.0,108,60,-31,48,9,18,27,36,11,6,3,5,21,12,6,9,31,17,10,14,41,23,13,18,"{'F': 2, 'P': 3}","{'C': 0, 'J': 5, 'Z': 4}","{'Q': 6, 'R': 3, 'S': 1, 'T': 3, 'H': 1, 'M': 0}","{'Y': 3, 'A': 2, 'B': 0, 'D': 0, 'E': 1, 'G': 3, 'I': 0, 'K': 3, 'L': 1, 'N': 0, 'O': 0, 'U': 3, 'V': 0, 'W': 1, 'X': 1}",TRUE,On Time
INV-ZZ-4825429,SCH-ZZ-4843596,ZZ,ZZ20240415AMDBLR3041,3041.0,Airbus A321-200,04/15/2024,2024-04-15 14:26:00,2024-04-15 18:12:00,AMD,BLR,200.0,232,142,-58,90,20,40,60,80,24,15,5,9,48,29,11,19,69,42,18,27,89,54,26,35,"{'F': 8, 'P': 1}","{'C': 9, 'J': 4, 'Z': 6}","{'Q': 11, 'R': 7, 'S': 0, 'T': 2, 'H': 5, 'M': 2}","{'Y': 4, 'A': 4, 'B': 0, 'D': 0, 'E': 3, 'G': 5, 'I': 2, 'K': 4, 'L': 1, 'N': 1, 'O': 3, 'U': 5, 'V': 1, 'W': 2, 'X': 0}",FALSE,On Time
INV-ZZ-9897581,SCH-ZZ-9117133,ZZ,ZZ20240415BLRCCU2504,2504.0,Boeing 777,04/15/2024,2024-04-15 15:35:00,2024-04-15 18:17:00,BLR,CCU,425.0,476,278,-147,198,42,85,127,170,49,29,13,20,97,57,28,40,147,86,41,61,188,110,60,78,"{'F': 15, 'P': 5}","{'C': 17, 'J': 12, 'Z': 11}","{'Q': 28, 'R': 11, 'S': 3, 'T': 1, 'H': 18, 'M': 0}","{'Y': 8, 'A': 9, 'B': 2, 'D': 1, 'E': 4, 'G': 11, 'I': 4, 'K': 12, 'L': 2, 'N': 4, 'O': 4, 'U': 9, 'V': 1, 'W': 3, 'X': 4}",TRUE,On Time
INV-ZZ-8404087,SCH-ZZ-6536717,ZZ,ZZ20240415GAUBOM2526,2526.0,Boeing 717,04/15/2024,2024-04-15 15:59:00,2024-04-16 05:45:00,GAU,BOM,100.0,114,63,-37,51,10,20,30,40,11,6,4,5,23,13,7,10,33,18,12,15,47,26,14,21,"{'F': 2, 'P': 3}","{'C': 2, 'J': 5, 'Z': 3}","{'Q': 5, 'R': 4, 'S': 0, 'T': 0, 'H': 5, 'M': 1}","{'Y': 2, 'A': 3, 'B': 1, 'D': 1, 'E': 0, 'G': 0, 'I': 1, 'K': 2, 'L': 2, 'N': 1, 'O': 1, 'U': 3, 'V': 2, 'W': 1, 'X': 1}",FALSE,On Time
INV-ZZ-5237537,SCH-ZZ-2693534,ZZ,ZZ20240415MAACJB4341,4341.0,Boeing 757,04/15/2024,2024-04-15 17:09:00,2024-04-15 22:11:00,MAA,CJB,209.0,230,127,-82,103,20,41,62,83,23,13,7,10,48,26,15,22,69,38,24,31,97,53,30,44,"{'F': 7, 'P': 3}","{'C': 11, 'J': 4, 'Z': 7}","{'Q': 12, 'R': 9, 'S': 3, 'T': 0, 'H': 6, 'M': 1}","{'Y': 5, 'A': 4, 'B': 2, 'D': 1, 'E': 3, 'G': 4, 'I': 3, 'K': 5, 'L': 3, 'N': 1, 'O': 1, 'U': 6, 'V': 1, 'W': 2, 'X': 3}",FALSE,On Time
INV-ZZ-9842230,SCH-ZZ-6980436,ZZ,ZZ20240415BOMBLR3556,3556.0,Boeing 777,04/15/2024,2024-04-15 22:10:00,2024-04-16 05:46:00,BOM,BLR,425.0,480,275,-150,205,42,85,127,170,47,27,15,20,96,55,30,41,145,83,44,62,193,110,60,83,"{'F': 11, 'P': 9}","{'C': 24, 'J': 4, 'Z': 13}","{'Q': 28, 'R': 14, 'S': 2, 'T': 6, 'H': 12, 'M': 0}","{'Y': 11, 'A': 11, 'B': 1, 'D': 5, 'E': 3, 'G': 10, 'I': 4, 'K': 8, 'L': 4, 'N': 5, 'O': 5, 'U': 10, 'V': 0, 'W': 2, 'X': 4}",FALSE,On Time
INV-ZZ-6059833,SCH-ZZ-1646787,ZZ,ZZ20240415GOIPNQ4429,4429.0,BAe 146,04/15/2024,2024-04-15 22:10:00,2024-04-16 08:41:00,GOI,PNQ,91.0,100,56,-35,44,9,18,27,36,10,6,3,4,21,12,6,9,32,18,9,14,41,23,13,18,"{'F': 2, 'P': 2}","{'C': 7, 'J': 0, 'Z': 2}","{'Q': 5, 'R': 2, 'S': 0, 'T': 1, 'H': 4, 'M': 2}","{'Y': 3, 'A': 3, 'B': 0, 'D': 1, 'E': 1, 'G': 3, 'I': 1, 'K': 1, 'L': 1, 'N': 0, 'O': 0, 'U': 2, 'V': 0, 'W': 1, 'X': 1}",TRUE,On Time
INV-ZZ-9851798,SCH-ZZ-6469147,ZZ,ZZ20240416HYDAMD2299,2299.0,Airbus A321 Neo,04/16/2024,2024-04-16 01:59:00,2024-04-16 21:45:00,HYD,AMD,220.0,251,150,-70,101,22,44,66,88,25,15,7,10,50,30,14,20,77,46,20,31,99,59,29,40,"{'F': 8, 'P': 2}","{'C': 10, 'J': 5, 'Z': 5}","{'Q': 14, 'R': 3, 'S': 0, 'T': 3, 'H': 10, 'M': 1}","{'Y': 5, 'A': 6, 'B': 3, 'D': 0, 'E': 2, 'G': 5, 'I': 2, 'K': 4, 'L': 2, 'N': 0, 'O': 2, 'U': 6, 'V': 1, 'W': 2, 'X': 0}",TRUE,On Time
INV-ZZ-6504518,SCH-ZZ-7589545,ZZ,ZZ20240416MAATRV2008,2008.0,Boeing 787,04/16/2024,2024-04-16 02:25:00,2024-04-16 21:44:00,MAA,TRV,270.0,317,196,-74,121,27,54,81,108,31,19,8,12,62,38,16,24,91,56,25,35,127,79,29,48,"{'F': 12, 'P': 0}","{'C': 12, 'J': 6, 'Z': 6}","{'Q': 16, 'R': 9, 'S': 0, 'T': 2, 'H': 6, 'M': 2}","{'Y': 7, 'A': 6, 'B': 0, 'D': 0, 'E': 0, 'G': 4, 'I': 3, 'K': 7, 'L': 3, 'N': 3, 'O': 1, 'U': 6, 'V': 2, 'W': 4, 'X': 2}",TRUE,On Time
INV-ZZ-4899984,SCH-ZZ-3838342,ZZ,ZZ20240416HYDCCU3772,3772.0,Boeing 767,04/16/2024,2024-04-16 05:58:00,2024-04-17 03:23:00,HYD,CCU,278.0,316,197,-81,119,27,55,83,111,32,20,7,12,61,38,17,23,99,62,21,37,129,80,31,49,"{'F': 7, 'P': 5}","{'C': 10, 'J': 8, 'Z': 5}","{'Q': 17, 'R': 14, 'S': 2, 'T': 0, 'H': 4, 'M': 0}","{'Y': 6, 'A': 7, 'B': 0, 'D': 2, 'E': 3, 'G': 7, 'I': 4, 'K': 7, 'L': 0, 'N': 1, 'O': 0, 'U': 6, 'V': 2, 'W': 1, 'X': 3}",TRUE,On Time
INV-ZZ-4997236,SCH-ZZ-2590363,ZZ,ZZ20240416HYDDEL2294,2294.0,Boeing 757,04/16/2024,2024-04-16 06:49:00,2024-04-17 06:20:00,HYD,DEL,209.0,250,154,-55,96,20,41,62,83,24,15,5,9,49,30,11,19,70,43,19,27,93,57,26,36,"{'F': 6, 'P': 3}","{'C': 7, 'J': 8, 'Z': 4}","{'Q': 12, 'R': 5, 'S': 0, 'T': 1, 'H': 7, 'M': 2}","{'Y': 2, 'A': 1, 'B': 1, 'D': 3, 'E': 0, 'G': 4, 'I': 2, 'K': 6, 'L': 2, 'N': 3, 'O': 2, 'U': 4, 'V': 3, 'W': 1, 'X': 2}",TRUE,On Time
INV-ZZ-2145247,SCH-ZZ-9117133,ZZ,ZZ20240416BLRCCU2504,2504.0,Boeing 777,04/16/2024,2024-04-16 15:35:00,2024-04-16 18:17:00,BLR,CCU,425.0,468,293,-132,175,42,85,127,170,47,29,13,18,94,59,26,35,143,90,37,53,202,126,44,76,"{'F': 16, 'P': 2}","{'C': 14, 'J': 8, 'Z': 13}","{'Q': 26, 'R': 14, 'S': 2, 'T': 0, 'H': 11, 'M': 0}","{'Y': 8, 'A': 9, 'B': 1, 'D': 5, 'E': 3, 'G': 4, 'I': 1, 'K': 13, 'L': 3, 'N': 2, 'O': 5, 'U': 11, 'V': 4, 'W': 3, 'X': 4}",TRUE,On Time
INV-ZZ-2936293,SCH-ZZ-9748991,ZZ,ZZ20240416MAABOM3117,3117.0,ATR 72,04/16/2024,2024-04-16 15:49:00,2024-04-16 21:43:00,MAA,BOM,72.0,82,52,-20,30,7,14,21,28,8,5,2,3,16,10,4,6,24,15,6,9,33,21,7,12,"{'F': 3, 'P': 0}","{'C': 3, 'J': 3, 'Z': 0}","{'Q': 6, 'R': 2, 'S': 1, 'T': 0, 'H': 0, 'M': 0}","{'Y': 2, 'A': 2, 'B': 1, 'D': 0, 'E': 0, 'G': 1, 'I': 1, 'K': 0, 'L': 1, 'N': 0, 'O': 1, 'U': 1, 'V': 1, 'W': 0, 'X': 1}",TRUE,On Time
INV-ZZ-7499978,SCH-ZZ-6536717,ZZ,ZZ20240416GAUBOM2526,2526.0,Boeing 717,04/16/2024,2024-04-16 15:59:00,2024-04-17 05:45:00,GAU,BOM,100.0,112,67,-33,45,10,20,30,40,11,7,3,4,22,13,7,9,36,21,9,15,45,27,13,18,"{'F': 3, 'P': 1}","{'C': 6, 'J': 1, 'Z': 2}","{'Q': 7, 'R': 3, 'S': 1, 'T': 0, 'H': 4, 'M': 0}","{'Y': 3, 'A': 2, 'B': 0, 'D': 0, 'E': 1, 'G': 0, 'I': 1, 'K': 1, 'L': 1, 'N': 1, 'O': 2, 'U': 2, 'V': 1, 'W': 2, 'X': 1}",TRUE,On Time
INV-ZZ-1494424,SCH-ZZ-6980436,ZZ,ZZ20240416BOMBLR3556,3556.0,Boeing 777,04/16/2024,2024-04-16 22:10:00,2024-04-17 05:46:00,BOM,BLR,425.0,476,288,-137,188,42,85,127,170,47,28,14,19,97,59,26,38,149,90,37,59,190,115,55,75,"{'F': 12, 'P': 7}","{'C': 14, 'J': 10, 'Z': 14}","{'Q': 25, 'R': 16, 'S': 0, 'T': 1, 'H': 14, 'M': 3}","{'Y': 10, 'A': 10, 'B': 4, 'D': 3, 'E': 3, 'G': 8, 'I': 2, 'K': 11, 'L': 0, 'N': 3, 'O': 4, 'U': 11, 'V': 4, 'W': 0, 'X': 2}",FALSE,On Time
INV-ZZ-3225488,SCH-ZZ-2404944,ZZ,ZZ20240416PNQGAU4614,4614.0,Airbus A320-200,04/16/2024,2024-04-16 23:31:00,2024-04-17 23:12:00,PNQ,GAU,150.0,167,104,-46,63,15,30,45,60,18,11,4,7,35,22,8,13,54,34,11,20,70,43,17,27,"{'F': 4, 'P': 3}","{'C': 7, 'J': 3, 'Z': 3}","{'Q': 13, 'R': 4, 'S': 0, 'T': 0, 'H': 3, 'M': 0}","{'Y': 3, 'A': 3, 'B': 0, 'D': 0, 'E': 2, 'G': 3, 'I': 2, 'K': 4, 'L': 1, 'N': 1, 'O': 1, 'U': 4, 'V': 2, 'W': 1, 'X': 0}",TRUE,On Time
INV-ZZ-5724322,SCH-ZZ-5041804,ZZ,ZZ20240416HYDCJB2880,2880.0,ATR 72,04/16/2024,2024-04-16 23:47:00,2024-04-17 13:44:00,HYD,CJB,72.0,84,48,-24,36,7,14,21,28,8,5,2,3,15,9,5,6,23,13,8,10,34,19,9,15,"{'F': 3, 'P': 0}","{'C': 5, 'J': 0, 'Z': 1}","{'Q': 5, 'R': 2, 'S': 0, 'T': 0, 'H': 3, 'M': 0}","{'Y': 2, 'A': 1, 'B': 1, 'D': 1, 'E': 1, 'G': 1, 'I': 0, 'K': 2, 'L': 1, 'N': 1, 'O': 0, 'U': 2, 'V': 1, 'W': 0, 'X': 1}",FALSE,On Time
INV-ZZ-5467478,SCH-ZZ-6469147,ZZ,ZZ20240417HYDAMD2299,2299.0,Airbus A321 Neo,04/17/2024,2024-04-17 01:59:00,2024-04-17 21:45:00,HYD,AMD,220.0,252,150,-70,102,22,44,66,88,26,15,7,11,52,31,13,21,77,46,20,31,103,61,27,42,"{'F': 8, 'P': 3}","{'C': 12, 'J': 5, 'Z': 4}","{'Q': 13, 'R': 6, 'S': 0, 'T': 2, 'H': 7, 'M': 3}","{'Y': 6, 'A': 5, 'B': 2, 'D': 3, 'E': 2, 'G': 6, 'I': 0, 'K': 5, 'L': 0, 'N': 3, 'O': 1, 'U': 7, 'V': 0, 'W': 1, 'X': 1}",TRUE,On Time
INV-ZZ-6094233,SCH-ZZ-7589545,ZZ,ZZ20240417MAATRV2008,2008.0,Boeing 787,04/17/2024,2024-04-17 02:25:00,2024-04-17 21:44:00,MAA,TRV,270.0,311,173,-97,138,27,54,81,108,32,18,9,14,60,33,21,27,96,54,27,42,126,70,38,56,"{'F': 11, 'P': 3}","{'C': 14, 'J': 12, 'Z': 1}","{'Q': 15, 'R': 11, 'S': 2, 'T': 5, 'H': 9, 'M': 0}","{'Y': 6, 'A': 6, 'B': 3, 'D': 3, 'E': 2, 'G': 7, 'I': 3, 'K': 6, 'L': 3, 'N': 2, 'O': 3, 'U': 6, 'V': 0, 'W': 4, 'X': 2}",TRUE,On Time
INV-ZZ-9201075,SCH-ZZ-2729891,ZZ,ZZ20240417GOIMAA4516,4516.0,Airbus A320-200,04/17/2024,2024-04-17 06:48:00,2024-04-18 02:04:00,GOI,MAA,150.0,170,100,-50,70,15,30,45,60,17,10,5,7,34,20,10,14,50,30,15,20,69,41,19,28,"{'F': 6, 'P': 1}","{'C': 9, 'J': 0, 'Z': 5}","{'Q': 12, 'R': 2, 'S': 0, 'T': 1, 'H': 5, 'M': 0}","{'Y': 4, 'A': 4, 'B': 1, 'D': 2, 'E': 2, 'G': 3, 'I': 1, 'K': 4, 'L': 0, 'N': 2, 'O': 0, 'U': 3, 'V': 1, 'W': 0, 'X': 1}",FALSE,On Time
INV-ZZ-5227729,SCH-ZZ-2590363,ZZ,ZZ20240417HYDDEL2294,2294.0,Boeing 757,04/17/2024,2024-04-17 06:49:00,2024-04-18 06:20:00,HYD,DEL,209.0,243,146,-63,97,20,41,62,83,24,14,6,10,46,28,13,18,73,44,18,29,97,58,25,39,"{'F': 8, 'P': 2}","{'C': 12, 'J': 5, 'Z': 1}","{'Q': 10, 'R': 5, 'S': 0, 'T': 1, 'H': 10, 'M': 3}","{'Y': 5, 'A': 3, 'B': 0, 'D': 2, 'E': 3, 'G': 6, 'I': 2, 'K': 1, 'L': 3, 'N': 2, 'O': 2, 'U': 6, 'V': 2, 'W': 1, 'X': 1}",FALSE,On Time
INV-ZZ-9541266,SCH-ZZ-7588562,ZZ,ZZ20240417AMDDEL3688,3688.0,Airbus A321-200,04/17/2024,2024-04-17 10:53:00,2024-04-17 19:22:00,AMD,DEL,200.0,233,127,-73,106,20,40,60,80,23,13,7,10,46,25,15,21,69,38,22,31,95,52,28,43,"{'F': 9, 'P': 1}","{'C': 10, 'J': 6, 'Z': 5}","{'Q': 14, 'R': 5, 'S': 1, 'T': 0, 'H': 8, 'M': 3}","{'Y': 5, 'A': 5, 'B': 1, 'D': 3, 'E': 3, 'G': 4, 'I': 2, 'K': 5, 'L': 1, 'N': 1, 'O': 1, 'U': 5, 'V': 1, 'W': 3, 'X': 3}",TRUE,On Time
INV-ZZ-7403881,SCH-ZZ-3249150,ZZ,ZZ20240417BOMAMD4704,4704.0,BAe 146,04/17/2024,2024-04-17 13:45:00,2024-04-17 19:31:00,BOM,AMD,91.0,101,62,-29,39,9,18,27,36,11,7,2,4,20,12,6,8,30,18,9,12,40,25,11,15,"{'F': 4, 'P': 0}","{'C': 2, 'J': 4, 'Z': 2}","{'Q': 3, 'R': 2, 'S': 0, 'T': 0, 'H': 4, 'M': 3}","{'Y': 2, 'A': 1, 'B': 1, 'D': 0, 'E': 0, 'G': 2, 'I': 1, 'K': 3, 'L': 0, 'N': 1, 'O': 1, 'U': 2, 'V': 0, 'W': 0, 'X': 1}",TRUE,On Time
INV-ZZ-2416555,SCH-ZZ-8796700,ZZ,ZZ20240417CCUBLR3294,3294.0,Airbus A320-200,04/17/2024,2024-04-17 14:54:00,2024-04-18 11:38:00,CCU,BLR,150.0,172,102,-48,70,15,30,45,60,18,11,4,7,35,21,9,14,51,30,15,21,71,42,18,29,"{'F': 6, 'P': 1}","{'C': 3, 'J': 5, 'Z': 6}","{'Q': 11, 'R': 7, 'S': 0, 'T': 0, 'H': 3, 'M': 0}","{'Y': 4, 'A': 2, 'B': 0, 'D': 2, 'E': 0, 'G': 4, 'I': 2, 'K': 3, 'L': 1, 'N': 2, 'O': 1, 'U': 3, 'V': 1, 'W': 2, 'X': 2}",TRUE,On Time
INV-ZZ-8537090,SCH-ZZ-9117133,ZZ,ZZ20240417BLRCCU2504,2504.0,Boeing 777,04/17/2024,2024-04-17 15:35:00,2024-04-17 18:17:00,BLR,CCU,425.0,497,287,-138,210,42,85,127,170,47,27,15,20,99,57,28,42,145,84,43,61,199,115,55,84,"{'F': 12, 'P': 8}","{'C': 18, 'J': 14, 'Z': 10}","{'Q': 23, 'R': 14, 'S': 2, 'T': 5, 'H': 17, 'M': 0}","{'Y': 12, 'A': 11, 'B': 4, 'D': 5, 'E': 1, 'G': 9, 'I': 0, 'K': 8, 'L': 4, 'N': 2, 'O': 1, 'U': 13, 'V': 5, 'W': 6, 'X': 3}",FALSE,On Time
INV-ZZ-6519240,SCH-ZZ-8346723,ZZ,ZZ20240417BLRHYD3027,3027.0,BAe 146,04/17/2024,2024-04-17 18:48:00,2024-04-18 02:58:00,BLR,HYD,91.0,102,60,-31,42,9,18,27,36,11,6,3,5,21,12,6,9,31,18,9,13,43,25,11,18,"{'F': 3, 'P': 2}","{'C': 1, 'J': 4, 'Z': 4}","{'Q': 4, 'R': 4, 'S': 0, 'T': 0, 'H': 5, 'M': 0}","{'Y': 2, 'A': 3, 'B': 1, 'D': 0, 'E': 1, 'G': 3, 'I': 0, 'K': 3, 'L': 1, 'N': 0, 'O': 1, 'U': 1, 'V': 1, 'W': 1, 'X': 0}",TRUE,On Time
INV-ZZ-7122012,SCH-ZZ-2312688,ZZ,ZZ20240417MAATRV4122,4122.0,Boeing 787,04/17/2024,2024-04-17 19:54:00,2024-04-18 02:05:00,MAA,TRV,270.0,302,180,-90,122,27,54,81,108,32,19,8,13,62,37,17,25,90,54,27,36,127,76,32,51,"{'F': 6, 'P': 7}","{'C': 15, 'J': 7, 'Z': 3}","{'Q': 13, 'R': 12, 'S': 1, 'T': 1, 'H': 9, 'M': 0}","{'Y': 6, 'A': 5, 'B': 2, 'D': 2, 'E': 3, 'G': 8, 'I': 3, 'K': 7, 'L': 2, 'N': 0, 'O': 2, 'U': 3, 'V': 2, 'W': 3, 'X': 3}",TRUE,On Time
INV-ZZ-6221422,SCH-ZZ-6095474,ZZ,ZZ20240417HYDAMD3723,3723.0,Airbus A320 Neo,04/17/2024,2024-04-17 20:40:00,2024-04-18 12:24:00,HYD,AMD,180.0,199,115,-65,84,18,36,54,72,21,12,6,9,41,24,12,17,63,36,18,27,81,47,25,34,"{'F': 5, 'P': 4}","{'C': 8, 'J': 6, 'Z': 3}","{'Q': 14, 'R': 6, 'S': 2, 'T': 0, 'H': 5, 'M': 0}","{'Y': 2, 'A': 3, 'B': 1, 'D': 2, 'E': 2, 'G': 5, 'I': 3, 'K': 2, 'L': 2, 'N': 2, 'O': 2, 'U': 4, 'V': 1, 'W': 2, 'X': 1}",TRUE,On Time
INV-ZZ-7208280,SCH-ZZ-6980436,ZZ,ZZ20240417BOMBLR3556,3556.0,Boeing 777,04/17/2024,2024-04-17 22:10:00,2024-04-18 05:46:00,BOM,BLR,425.0,486,269,-156,217,42,85,127,170,48,27,15,21,96,53,32,43,144,80,47,64,200,111,59,89,"{'F': 16, 'P': 5}","{'C': 23, 'J': 6, 'Z': 14}","{'Q': 26, 'R': 19, 'S': 0, 'T': 2, 'H': 14, 'M': 3}","{'Y': 12, 'A': 9, 'B': 5, 'D': 3, 'E': 3, 'G': 12, 'I': 6, 'K': 8, 'L': 3, 'N': 5, 'O': 6, 'U': 11, 'V': 2, 'W': 2, 'X': 2}",FALSE,On Time
INV-ZZ-2930774,SCH-ZZ-1646787,ZZ,ZZ20240417GOIPNQ4429,4429.0,BAe 146,04/17/2024,2024-04-17 22:10:00,2024-04-18 08:41:00,GOI,PNQ,91.0,104,66,-25,38,9,18,27,36,10,6,3,4,20,13,5,7,31,20,7,11,40,25,11,15,"{'F': 1, 'P': 3}","{'C': 4, 'J': 2, 'Z': 1}","{'Q': 7, 'R': 1, 'S': 0, 'T': 1, 'H': 2, 'M': 0}","{'Y': 3, 'A': 2, 'B': 0, 'D': 1, 'E': 0, 'G': 3, 'I': 0, 'K': 2, 'L': 1, 'N': 1, 'O': 0, 'U': 2, 'V': 0, 'W': 0, 'X': 0}",FALSE,On Time
INV-ZZ-7199346,SCH-ZZ-2404944,ZZ,ZZ20240417PNQGAU4614,4614.0,Airbus A320-200,04/17/2024,2024-04-17 23:31:00,2024-04-18 23:12:00,PNQ,GAU,150.0,170,103,-47,67,15,30,45,60,18,11,4,7,35,21,9,14,52,31,14,21,66,40,20,26,"{'F': 4, 'P': 3}","{'C': 6, 'J': 5, 'Z': 3}","{'Q': 6, 'R': 5, 'S': 1, 'T': 3, 'H': 6, 'M': 0}","{'Y': 4, 'A': 2, 'B': 2, 'D': 0, 'E': 2, 'G': 4, 'I': 1, 'K': 3, 'L': 2, 'N': 1, 'O': 1, 'U': 1, 'V': 1, 'W': 2, 'X': 0}",TRUE,On Time
INV-ZZ-5777960,SCH-ZZ-5041804,ZZ,ZZ20240417HYDCJB2880,2880.0,ATR 72,04/17/2024,2024-04-17 23:47:00,2024-04-18 13:44:00,HYD,CJB,72.0,84,52,-20,32,7,14,21,28,8,5,2,3,17,10,4,7,25,15,6,10,33,20,8,13,"{'F': 3, 'P': 0}","{'C': 3, 'J': 3, 'Z': 1}","{'Q': 5, 'R': 1, 'S': 1, 'T': 2, 'H': 1, 'M': 0}","{'Y': 2, 'A': 2, 'B': 1, 'D': 1, 'E': 1, 'G': 0, 'I': 1, 'K': 2, 'L': 1, 'N': 0, 'O': 1, 'U': 0, 'V': 0, 'W': 0, 'X': 1}",FALSE,On Time
INV-ZZ-2698906,SCH-ZZ-7589545,ZZ,ZZ20240418MAATRV2008,2008.0,Boeing 787,04/18/2024,2024-04-18 02:25:00,2024-04-18 21:44:00,MAA,TRV,270.0,298,177,-93,121,27,54,81,108,31,18,9,13,62,37,17,25,90,54,27,36,129,77,31,52,"{'F': 13, 'P': 0}","{'C': 13, 'J': 10, 'Z': 2}","{'Q': 19, 'R': 8, 'S': 1, 'T': 1, 'H': 7, 'M': 0}","{'Y': 7, 'A': 4, 'B': 1, 'D': 2, 'E': 4, 'G': 7, 'I': 3, 'K': 7, 'L': 1, 'N': 3, 'O': 1, 'U': 6, 'V': 3, 'W': 1, 'X': 2}",TRUE,On Time
INV-ZZ-5048860,SCH-ZZ-2729891,ZZ,ZZ20240418GOIMAA4516,4516.0,Airbus A320-200,04/18/2024,2024-04-18 06:48:00,2024-04-19 02:04:00,GOI,MAA,150.0,175,104,-46,71,15,30,45,60,17,10,5,7,34,20,10,14,53,31,14,22,72,43,17,29,"{'F': 4, 'P': 3}","{'C': 6, 'J': 8, 'Z': 0}","{'Q': 13, 'R': 6, 'S': 0, 'T': 0, 'H': 3, 'M': 0}","{'Y': 3, 'A': 4, 'B': 1, 'D': 2, 'E': 0, 'G': 2, 'I': 0, 'K': 3, 'L': 2, 'N': 2, 'O': 1, 'U': 4, 'V': 2, 'W': 2, 'X': 1}",FALSE,On Time
INV-ZZ-8695088,SCH-ZZ-2590363,ZZ,ZZ20240418HYDDEL2294,2294.0,Boeing 757,04/18/2024,2024-04-18 06:49:00,2024-04-19 06:20:00,HYD,DEL,209.0,240,137,-72,103,20,41,62,83,22,13,7,9,45,26,15,19,71,40,22,31,97,55,28,42,"{'F': 6, 'P': 3}","{'C': 9, 'J': 6, 'Z': 4}","{'Q': 14, 'R': 8, 'S': 0, 'T': 3, 'H': 6, 'M': 0}","{'Y': 3, 'A': 6, 'B': 2, 'D': 2, 'E': 1, 'G': 5, 'I': 3, 'K': 5, 'L': 2, 'N': 3, 'O': 1, 'U': 4, 'V': 3, 'W': 1, 'X': 1}",FALSE,On Time
INV-ZZ-3121065,SCH-ZZ-5840327,ZZ,ZZ20240418IDRHYD2795,2795.0,Airbus A321 Neo,04/18/2024,2024-04-18 14:29:00,2024-04-19 02:10:00,IDR,HYD,220.0,244,147,-73,97,22,44,66,88,24,15,7,9,50,30,14,20,78,47,19,31,102,62,26,40,"{'F': 6, 'P': 3}","{'C': 11, 'J': 3, 'Z': 6}","{'Q': 15, 'R': 4, 'S': 0, 'T': 3, 'H': 9, 'M': 0}","{'Y': 4, 'A': 5, 'B': 0, 'D': 0, 'E': 3, 'G': 7, 'I': 0, 'K': 5, 'L': 2, 'N': 1, 'O': 3, 'U': 5, 'V': 1, 'W': 1, 'X': 3}",FALSE,On Time
INV-ZZ-9452188,SCH-ZZ-9117133,ZZ,ZZ20240418BLRCCU2504,2504.0,Boeing 777,04/18/2024,2024-04-18 15:35:00,2024-04-18 18:17:00,BLR,CCU,425.0,490,281,-144,209,42,85,127,170,48,27,15,21,100,57,28,43,140,80,47,60,201,115,55,86,"{'F': 18, 'P': 3}","{'C': 21, 'J': 10, 'Z': 12}","{'Q': 25, 'R': 14, 'S': 0, 'T': 1, 'H': 14, 'M': 6}","{'Y': 11, 'A': 9, 'B': 4, 'D': 3, 'E': 1, 'G': 10, 'I': 3, 'K': 10, 'L': 5, 'N': 4, 'O': 3, 'U': 12, 'V': 0, 'W': 5, 'X': 6}",FALSE,On Time
INV-ZZ-1274007,SCH-ZZ-9748991,ZZ,ZZ20240418MAABOM3117,3117.0,ATR 72,04/18/2024,2024-04-18 15:49:00,2024-04-18 21:43:00,MAA,BOM,72.0,80,46,-26,34,7,14,21,28,8,5,2,3,16,9,5,7,25,14,7,11,31,18,10,13,"{'F': 1, 'P': 2}","{'C': 1, 'J': 2, 'Z': 4}","{'Q': 3, 'R': 2, 'S': 1, 'T': 1, 'H': 3, 'M': 1}","{'Y': 2, 'A': 1, 'B': 1, 'D': 0, 'E': 0, 'G': 2, 'I': 0, 'K': 2, 'L': 0, 'N': 1, 'O': 0, 'U': 2, 'V': 0, 'W': 1, 'X': 1}",TRUE,On Time
INV-ZZ-3853891,SCH-ZZ-7068651,ZZ,ZZ20240418CCUHYD3723,3723.0,Boeing 787,04/18/2024,2024-04-18 16:19:00,2024-04-19 00:54:00,CCU,HYD,270.0,311,177,-93,134,27,54,81,108,30,17,10,13,63,36,18,27,90,51,30,39,126,72,36,54,"{'F': 10, 'P': 3}","{'C': 16, 'J': 5, 'Z': 6}","{'Q': 16, 'R': 12, 'S': 1, 'T': 2, 'H': 8, 'M': 0}","{'Y': 7, 'A': 7, 'B': 3, 'D': 2, 'E': 3, 'G': 8, 'I': 2, 'K': 5, 'L': 0, 'N': 3, 'O': 4, 'U': 5, 'V': 0, 'W': 1, 'X': 4}",FALSE,On Time
INV-ZZ-6268317,SCH-ZZ-8346723,ZZ,ZZ20240418BLRHYD3027,3027.0,BAe 146,04/18/2024,2024-04-18 18:48:00,2024-04-19 02:58:00,BLR,HYD,91.0,101,63,-28,38,9,18,27,36,10,6,3,4,20,13,5,7,31,19,8,12,43,27,9,16,"{'F': 3, 'P': 1}","{'C': 4, 'J': 3, 'Z': 0}","{'Q': 4, 'R': 2, 'S': 0, 'T': 0, 'H': 5, 'M': 1}","{'Y': 2, 'A': 3, 'B': 0, 'D': 0, 'E': 0, 'G': 3, 'I': 1, 'K': 3, 'L': 0, 'N': 1, 'O': 0, 'U': 2, 'V': 0, 'W': 0, 'X': 1}",FALSE,On Time
INV-ZZ-1535659,SCH-ZZ-6095474,ZZ,ZZ20240418HYDAMD3723,3723.0,Airbus A320 Neo,04/18/2024,2024-04-18 20:40:00,2024-04-19 12:24:00,HYD,AMD,180.0,199,116,-64,83,18,36,54,72,20,12,6,8,42,24,12,18,61,36,18,25,82,48,24,34,"{'F': 8, 'P': 0}","{'C': 7, 'J': 4, 'Z': 7}","{'Q': 9, 'R': 4, 'S': 1, 'T': 2, 'H': 9, 'M': 0}","{'Y': 2, 'A': 5, 'B': 2, 'D': 1, 'E': 1, 'G': 5, 'I': 1, 'K': 4, 'L': 1, 'N': 3, 'O': 2, 'U': 4, 'V': 0, 'W': 2, 'X': 1}",TRUE,On Time
INV-ZZ-3676497,SCH-ZZ-2404944,ZZ,ZZ20240418PNQGAU4614,4614.0,Airbus A320-200,04/18/2024,2024-04-18 23:31:00,2024-04-19 23:12:00,PNQ,GAU,150.0,179,101,-49,78,15,30,45,60,17,10,5,7,33,19,11,14,53,30,15,23,70,40,20,30,"{'F': 3, 'P': 4}","{'C': 7, 'J': 2, 'Z': 5}","{'Q': 11, 'R': 5, 'S': 0, 'T': 1, 'H': 6, 'M': 0}","{'Y': 4, 'A': 4, 'B': 2, 'D': 2, 'E': 2, 'G': 2, 'I': 0, 'K': 2, 'L': 1, 'N': 0, 'O': 2, 'U': 4, 'V': 2, 'W': 2, 'X': 1}",FALSE,On Time
INV-ZZ-4743206,SCH-ZZ-5041804,ZZ,ZZ20240418HYDCJB2880,2880.0,ATR 72,04/18/2024,2024-04-18 23:47:00,2024-04-19 13:44:00,HYD,CJB,72.0,82,49,-23,33,7,14,21,28,8,5,2,3,16,10,4,6,25,15,6,10,33,20,8,13,"{'F': 1, 'P': 2}","{'C': 6, 'J': 0, 'Z': 0}","{'Q': 5, 'R': 3, 'S': 0, 'T': 0, 'H': 2, 'M': 0}","{'Y': 2, 'A': 1, 'B': 1, 'D': 0, 'E': 1, 'G': 1, 'I': 0, 'K': 2, 'L': 1, 'N': 0, 'O': 0, 'U': 1, 'V': 1, 'W': 1, 'X': 1}",TRUE,On Time
INV-ZZ-7799468,SCH-ZZ-3930555,ZZ,ZZ20240419JAILKO4478,4478.0,Airbus A321-200,04/19/2024,2024-04-19 01:47:00,2024-04-19 19:45:00,JAI,LKO,200.0,239,143,-57,96,20,40,60,80,23,14,6,9,47,28,12,19,67,40,20,27,91,54,26,37,"{'F': 8, 'P': 1}","{'C': 8, 'J': 10, 'Z': 1}","{'Q': 10, 'R': 5, 'S': 3, 'T': 0, 'H': 9, 'M': 0}","{'Y': 5, 'A': 4, 'B': 0, 'D': 2, 'E': 2, 'G': 3, 'I': 2, 'K': 2, 'L': 2, 'N': 3, 'O': 2, 'U': 5, 'V': 2, 'W': 2, 'X': 1}",FALSE,On Time
INV-ZZ-7465065,SCH-ZZ-6469147,ZZ,ZZ20240419HYDAMD2299,2299.0,Airbus A321 Neo,04/19/2024,2024-04-19 01:59:00,2024-04-19 21:45:00,HYD,AMD,220.0,248,146,-74,102,22,44,66,88,26,15,7,11,50,29,15,21,76,45,21,31,101,59,29,42,"{'F': 9, 'P': 2}","{'C': 11, 'J': 3, 'Z': 7}","{'Q': 16, 'R': 5, 'S': 0, 'T': 4, 'H': 4, 'M': 2}","{'Y': 5, 'A': 5, 'B': 1, 'D': 2, 'E': 2, 'G': 6, 'I': 1, 'K': 6, 'L': 2, 'N': 2, 'O': 1, 'U': 4, 'V': 2, 'W': 0, 'X': 3}",FALSE,On Time
INV-ZZ-8764000,SCH-ZZ-3838342,ZZ,ZZ20240419HYDCCU3772,3772.0,Boeing 767,04/19/2024,2024-04-19 05:58:00,2024-04-20 03:23:00,HYD,CCU,278.0,311,182,-96,129,27,55,83,111,31,18,9,13,65,38,17,27,99,58,25,41,128,75,36,53,"{'F': 4, 'P': 9}","{'C': 9, 'J': 7, 'Z': 11}","{'Q': 18, 'R': 10, 'S': 2, 'T': 0, 'H': 9, 'M': 2}","{'Y': 6, 'A': 7, 'B': 2, 'D': 2, 'E': 1, 'G': 7, 'I': 2, 'K': 5, 'L': 2, 'N': 2, 'O': 3, 'U': 4, 'V': 3, 'W': 3, 'X': 4}",FALSE,On Time
INV-ZZ-9024315,SCH-ZZ-4843596,ZZ,ZZ20240419AMDBLR3041,3041.0,Airbus A321-200,04/19/2024,2024-04-19 14:26:00,2024-04-19 18:12:00,AMD,BLR,200.0,224,137,-63,87,20,40,60,80,23,14,6,9,46,28,12,18,71,43,17,28,91,56,24,35,"{'F': 5, 'P': 4}","{'C': 9, 'J': 7, 'Z': 2}","{'Q': 15, 'R': 8, 'S': 1, 'T': 0, 'H': 4, 'M': 0}","{'Y': 6, 'A': 4, 'B': 0, 'D': 1, 'E': 0, 'G': 5, 'I': 1, 'K': 4, 'L': 2, 'N': 1, 'O': 3, 'U': 6, 'V': 1, 'W': 1, 'X': 0}",TRUE,On Time
INV-ZZ-8229073,SCH-ZZ-6536717,ZZ,ZZ20240419GAUBOM2526,2526.0,Boeing 717,04/19/2024,2024-04-19 15:59:00,2024-04-20 05:45:00,GAU,BOM,100.0,117,68,-32,49,10,20,30,40,12,7,3,5,24,14,6,10,34,20,10,14,46,27,13,19,"{'F': 3, 'P': 2}","{'C': 4, 'J': 2, 'Z': 4}","{'Q': 7, 'R': 4, 'S': 0, 'T': 0, 'H': 3, 'M': 0}","{'Y': 3, 'A': 3, 'B': 0, 'D': 1, 'E': 1, 'G': 2, 'I': 0, 'K': 2, 'L': 2, 'N': 0, 'O': 2, 'U': 2, 'V': 0, 'W': 1, 'X': 0}",FALSE,On Time
INV-ZZ-9167971,SCH-ZZ-4269181,ZZ,ZZ20240419MAACJB2885,2885.0,Boeing 777,04/19/2024,2024-04-19 17:43:00,2024-04-20 09:14:00,MAA,CJB,425.0,471,262,-163,209,42,85,127,170,49,27,15,22,95,53,32,42,152,85,42,67,201,112,58,89,"{'F': 14, 'P': 8}","{'C': 16, 'J': 15, 'Z': 11}","{'Q': 25, 'R': 15, 'S': 3, 'T': 8, 'H': 16, 'M': 0}","{'Y': 12, 'A': 4, 'B': 2, 'D': 4, 'E': 5, 'G': 12, 'I': 4, 'K': 12, 'L': 4, 'N': 4, 'O': 3, 'U': 12, 'V': 4, 'W': 4, 'X': 3}",FALSE,On Time
INV-ZZ-1078045,SCH-ZZ-8346723,ZZ,ZZ20240419BLRHYD3027,3027.0,BAe 146,04/19/2024,2024-04-19 18:48:00,2024-04-20 02:58:00,BLR,HYD,91.0,106,60,-31,46,9,18,27,36,10,6,3,4,21,12,6,9,31,17,10,14,41,23,13,18,"{'F': 1, 'P': 3}","{'C': 5, 'J': 2, 'Z': 2}","{'Q': 3, 'R': 5, 'S': 0, 'T': 2, 'H': 3, 'M': 1}","{'Y': 2, 'A': 2, 'B': 1, 'D': 0, 'E': 0, 'G': 3, 'I': 1, 'K': 2, 'L': 0, 'N': 1, 'O': 0, 'U': 3, 'V': 1, 'W': 1, 'X': 1}",FALSE,On Time
INV-ZZ-5822757,SCH-ZZ-4253453,ZZ,ZZ20240419AMDMAA4012,4012.0,Boeing 757,04/19/2024,2024-04-19 19:00:00,2024-04-19 22:08:00,AMD,MAA,209.0,244,134,-75,110,20,41,62,83,22,12,8,10,46,25,16,21,74,41,21,33,96,53,30,43,"{'F': 7, 'P': 3}","{'C': 7, 'J': 4, 'Z': 10}","{'Q': 16, 'R': 4, 'S': 4, 'T': 1, 'H': 8, 'M': 0}","{'Y': 4, 'A': 6, 'B': 0, 'D': 3, 'E': 0, 'G': 4, 'I': 3, 'K': 6, 'L': 3, 'N': 3, 'O': 1, 'U': 5, 'V': 2, 'W': 1, 'X': 2}",TRUE,On Time
INV-ZZ-7743686,SCH-ZZ-2312688,ZZ,ZZ20240419MAATRV4122,4122.0,Boeing 787,04/19/2024,2024-04-19 19:54:00,2024-04-20 02:05:00,MAA,TRV,270.0,319,182,-88,137,27,54,81,108,31,18,9,13,62,35,19,27,90,51,30,39,121,69,39,52,"{'F': 6, 'P': 7}","{'C': 11, 'J': 8, 'Z': 8}","{'Q': 18, 'R': 9, 'S': 0, 'T': 3, 'H': 9, 'M': 0}","{'Y': 7, 'A': 6, 'B': 2, 'D': 2, 'E': 3, 'G': 5, 'I': 3, 'K': 7, 'L': 2, 'N': 1, 'O': 3, 'U': 7, 'V': 0, 'W': 1, 'X': 3}",TRUE,On Time
INV-ZZ-9874457,SCH-ZZ-1216883,ZZ,ZZ20240419DELBLR3152,3152.0,Boeing 777,04/19/2024,2024-04-19 21:06:00,2024-04-20 16:58:00,DEL,BLR,425.0,484,287,-138,197,42,85,127,170,49,29,13,20,94,56,29,38,145,86,41,59,203,121,49,82,"{'F': 16, 'P': 4}","{'C': 21, 'J': 14, 'Z': 3}","{'Q': 27, 'R': 13, 'S': 1, 'T': 5, 'H': 12, 'M': 1}","{'Y': 11, 'A': 11, 'B': 2, 'D': 5, 'E': 3, 'G': 12, 'I': 6, 'K': 8, 'L': 0, 'N': 4, 'O': 5, 'U': 6, 'V': 2, 'W': 2, 'X': 5}",FALSE,On Time
INV-ZZ-2324946,SCH-ZZ-6980436,ZZ,ZZ20240419BOMBLR3556,3556.0,Boeing 777,04/19/2024,2024-04-19 22:10:00,2024-04-20 05:46:00,BOM,BLR,425.0,505,312,-113,193,42,85,127,170,47,29,13,18,101,62,23,39,142,88,39,54,201,124,46,77,"{'F': 10, 'P': 8}","{'C': 20, 'J': 10, 'Z': 9}","{'Q': 23, 'R': 16, 'S': 0, 'T': 3, 'H': 11, 'M': 1}","{'Y': 13, 'A': 10, 'B': 0, 'D': 4, 'E': 2, 'G': 9, 'I': 2, 'K': 9, 'L': 4, 'N': 5, 'O': 3, 'U': 7, 'V': 2, 'W': 2, 'X': 5}",TRUE,On Time
INV-ZZ-4559761,SCH-ZZ-9212586,ZZ,ZZ20240420AMDDEL3431,3431.0,Airbus A321-200,04/20/2024,2024-04-20 01:10:00,2024-04-20 07:07:00,AMD,DEL,200.0,226,133,-67,93,20,40,60,80,23,14,6,9,45,26,14,19,72,42,18,30,91,53,27,38,"{'F': 8, 'P': 1}","{'C': 10, 'J': 6, 'Z': 3}","{'Q': 14, 'R': 2, 'S': 1, 'T': 3, 'H': 9, 'M': 1}","{'Y': 5, 'A': 4, 'B': 1, 'D': 3, 'E': 3, 'G': 2, 'I': 2, 'K': 2, 'L': 2, 'N': 1, 'O': 2, 'U': 6, 'V': 2, 'W': 1, 'X': 2}",FALSE,On Time
INV-ZZ-1947192,SCH-ZZ-7589545,ZZ,ZZ20240420MAATRV2008,2008.0,Boeing 787,04/20/2024,2024-04-20 02:25:00,2024-04-20 21:44:00,MAA,TRV,270.0,312,171,-99,141,27,54,81,108,32,18,9,14,60,33,21,27,89,49,32,40,125,68,40,57,"{'F': 10, 'P': 4}","{'C': 11, 'J': 6, 'Z': 10}","{'Q': 21, 'R': 6, 'S': 2, 'T': 0, 'H': 11, 'M': 0}","{'Y': 8, 'A': 8, 'B': 3, 'D': 2, 'E': 2, 'G': 8, 'I': 3, 'K': 5, 'L': 2, 'N': 2, 'O': 2, 'U': 6, 'V': 3, 'W': 2, 'X': 1}",TRUE,On Time
INV-ZZ-9643127,SCH-ZZ-3838342,ZZ,ZZ20240420HYDCCU3772,3772.0,Boeing 767,04/20/2024,2024-04-20 05:58:00,2024-04-21 03:23:00,HYD,CCU,278.0,330,192,-86,138,27,55,83,111,32,19,8,13,63,37,18,26,93,54,29,39,132,77,34,55,"{'F': 8, 'P': 5}","{'C': 11, 'J': 8, 'Z': 7}","{'Q': 18, 'R': 9, 'S': 1, 'T': 0, 'H': 10, 'M': 1}","{'Y': 8, 'A': 4, 'B': 1, 'D': 3, 'E': 3, 'G': 8, 'I': 1, 'K': 7, 'L': 3, 'N': 2, 'O': 3, 'U': 6, 'V': 3, 'W': 0, 'X': 3}",FALSE,On Time
INV-ZZ-3158279,SCH-ZZ-2590363,ZZ,ZZ20240420HYDDEL2294,2294.0,Boeing 757,04/20/2024,2024-04-20 06:49:00,2024-04-21 06:20:00,HYD,DEL,209.0,246,135,-74,111,20,41,62,83,22,12,8,10,48,26,15,22,70,38,24,32,97,53,30,44,"{'F': 6, 'P': 4}","{'C': 13, 'J': 6, 'Z': 3}","{'Q': 15, 'R': 6, 'S': 0, 'T': 4, 'H': 5, 'M': 2}","{'Y': 6, 'A': 4, 'B': 2, 'D': 0, 'E': 3, 'G': 3, 'I': 3, 'K': 5, 'L': 1, 'N': 2, 'O': 1, 'U': 6, 'V': 3, 'W': 2, 'X': 3}",FALSE,On Time
INV-ZZ-2335694,SCH-ZZ-6544056,ZZ,ZZ20240420BOMDEL3869,3869.0,BAe 146,04/20/2024,2024-04-20 07:20:00,2024-04-20 09:24:00,BOM,DEL,91.0,105,60,-31,45,9,18,27,36,10,6,3,4,21,12,6,9,32,18,9,14,42,24,12,18,"{'F': 3, 'P': 1}","{'C': 5, 'J': 2, 'Z': 2}","{'Q': 7, 'R': 0, 'S': 0, 'T': 2, 'H': 2, 'M': 3}","{'Y': 3, 'A': 3, 'B': 1, 'D': 0, 'E': 0, 'G': 2, 'I': 0, 'K': 2, 'L': 0, 'N': 1, 'O': 1, 'U': 3, 'V': 1, 'W': 1, 'X': 0}",FALSE,On Time
INV-ZZ-3466080,SCH-ZZ-3820040,ZZ,ZZ20240420MAATRV2047,2047.0,Boeing 767,04/20/2024,2024-04-20 07:41:00,2024-04-21 02:50:00,MAA,TRV,278.0,314,178,-100,136,27,55,83,111,31,18,9,13,64,36,19,28,95,54,29,41,122,69,42,53,"{'F': 9, 'P': 4}","{'C': 16, 'J': 6, 'Z': 6}","{'Q': 17, 'R': 10, 'S': 2, 'T': 0, 'H': 12, 'M': 0}","{'Y': 4, 'A': 1, 'B': 1, 'D': 3, 'E': 2, 'G': 8, 'I': 3, 'K': 8, 'L': 4, 'N': 3, 'O': 3, 'U': 6, 'V': 1, 'W': 2, 'X': 4}",TRUE,On Time
INV-ZZ-4396538,SCH-ZZ-3249150,ZZ,ZZ20240420BOMAMD4704,4704.0,BAe 146,04/20/2024,2024-04-20 13:45:00,2024-04-20 19:31:00,BOM,AMD,91.0,102,61,-30,41,9,18,27,36,11,7,2,4,21,13,5,8,30,18,9,12,41,25,11,16,"{'F': 4, 'P': 0}","{'C': 5, 'J': 2, 'Z': 1}","{'Q': 1, 'R': 3, 'S': 3, 'T': 3, 'H': 1, 'M': 1}","{'Y': 3, 'A': 2, 'B': 0, 'D': 0, 'E': 1, 'G': 3, 'I': 1, 'K': 2, 'L': 0, 'N': 0, 'O': 1, 'U': 3, 'V': 0, 'W': 0, 'X': 0}",TRUE,On Time
INV-ZZ-4979081,SCH-ZZ-8796700,ZZ,ZZ20240420CCUBLR3294,3294.0,Airbus A320-200,04/20/2024,2024-04-20 14:54:00,2024-04-21 11:38:00,CCU,BLR,150.0,171,97,-53,74,15,30,45,60,17,10,5,7,35,20,10,15,53,30,15,23,66,37,23,29,"{'F': 5, 'P': 2}","{'C': 7, 'J': 3, 'Z': 5}","{'Q': 12, 'R': 6, 'S': 0, 'T': 0, 'H': 5, 'M': 0}","{'Y': 4, 'A': 3, 'B': 1, 'D': 1, 'E': 2, 'G': 4, 'I': 0, 'K': 3, 'L': 2, 'N': 1, 'O': 2, 'U': 3, 'V': 1, 'W': 0, 'X': 2}",TRUE,On Time
INV-ZZ-8513261,SCH-ZZ-7068651,ZZ,ZZ20240420CCUHYD3723,3723.0,Boeing 787,04/20/2024,2024-04-20 16:19:00,2024-04-21 00:54:00,CCU,HYD,270.0,312,181,-89,131,27,54,81,108,32,19,8,13,60,35,19,25,93,54,27,39,120,70,38,50,"{'F': 9, 'P': 4}","{'C': 18, 'J': 3, 'Z': 4}","{'Q': 16, 'R': 11, 'S': 3, 'T': 0, 'H': 5, 'M': 4}","{'Y': 6, 'A': 4, 'B': 1, 'D': 3, 'E': 0, 'G': 7, 'I': 1, 'K': 6, 'L': 3, 'N': 1, 'O': 2, 'U': 6, 'V': 4, 'W': 2, 'X': 4}",FALSE,On Time
INV-ZZ-8547709,SCH-ZZ-8577412,ZZ,ZZ20240420GOIBOM4529,4529.0,Boeing 777-300,04/20/2024,2024-04-20 17:42:00,2024-04-20 19:44:00,GOI,BOM,360.0,417,248,-112,169,36,72,108,144,43,26,10,17,86,51,21,35,120,71,37,49,169,101,43,68,"{'F': 15, 'P': 2}","{'C': 18, 'J': 9, 'Z': 8}","{'Q': 20, 'R': 10, 'S': 0, 'T': 4, 'H': 11, 'M': 4}","{'Y': 10, 'A': 10, 'B': 3, 'D': 2, 'E': 1, 'G': 6, 'I': 4, 'K': 9, 'L': 3, 'N': 2, 'O': 2, 'U': 10, 'V': 1, 'W': 3, 'X': 2}",TRUE,On Time
INV-ZZ-8588399,SCH-ZZ-4253453,ZZ,ZZ20240420AMDMAA4012,4012.0,Boeing 757,04/20/2024,2024-04-20 19:00:00,2024-04-20 22:08:00,AMD,MAA,209.0,247,153,-56,94,20,41,62,83,23,14,6,9,49,30,11,19,72,45,17,27,94,58,25,36,"{'F': 6, 'P': 3}","{'C': 10, 'J': 6, 'Z': 3}","{'Q': 17, 'R': 3, 'S': 0, 'T': 0, 'H': 7, 'M': 0}","{'Y': 4, 'A': 4, 'B': 1, 'D': 1, 'E': 3, 'G': 6, 'I': 1, 'K': 3, 'L': 2, 'N': 2, 'O': 2, 'U': 4, 'V': 1, 'W': 2, 'X': 0}",FALSE,On Time
INV-ZZ-4213535,SCH-ZZ-2312688,ZZ,ZZ20240420MAATRV4122,4122.0,Boeing 787,04/20/2024,2024-04-20 19:54:00,2024-04-21 02:05:00,MAA,TRV,270.0,300,172,-98,128,27,54,81,108,31,18,9,13,61,35,19,26,97,55,26,42,121,69,39,52,"{'F': 7, 'P': 6}","{'C': 14, 'J': 3, 'Z': 9}","{'Q': 16, 'R': 11, 'S': 3, 'T': 0, 'H': 12, 'M': 0}","{'Y': 6, 'A': 6, 'B': 3, 'D': 2, 'E': 0, 'G': 4, 'I': 2, 'K': 7, 'L': 3, 'N': 3, 'O': 3, 'U': 8, 'V': 1, 'W': 0, 'X': 4}",TRUE,On Time
INV-ZZ-9961664,SCH-ZZ-6095474,ZZ,ZZ20240420HYDAMD3723,3723.0,Airbus A320 Neo,04/20/2024,2024-04-20 20:40:00,2024-04-21 12:24:00,HYD,AMD,180.0,215,117,-63,98,18,36,54,72,21,11,7,10,41,22,14,19,65,35,19,30,82,45,27,37,"{'F': 7, 'P': 3}","{'C': 11, 'J': 3, 'Z': 5}","{'Q': 11, 'R': 5, 'S': 2, 'T': 2, 'H': 6, 'M': 4}","{'Y': 4, 'A': 4, 'B': 3, 'D': 3, 'E': 2, 'G': 4, 'I': 1, 'K': 3, 'L': 3, 'N': 2, 'O': 0, 'U': 3, 'V': 1, 'W': 3, 'X': 1}",FALSE,On Time
INV-ZZ-5703925,SCH-ZZ-1646787,ZZ,ZZ20240420GOIPNQ4429,4429.0,BAe 146,04/20/2024,2024-04-20 22:10:00,2024-04-21 08:41:00,GOI,PNQ,91.0,106,63,-28,43,9,18,27,36,10,6,3,4,20,12,6,8,32,19,8,13,41,24,12,17,"{'F': 4, 'P': 0}","{'C': 4, 'J': 4, 'Z': 0}","{'Q': 6, 'R': 3, 'S': 2, 'T': 0, 'H': 2, 'M': 0}","{'Y': 3, 'A': 2, 'B': 1, 'D': 1, 'E': 0, 'G': 3, 'I': 1, 'K': 3, 'L': 0, 'N': 0, 'O': 0, 'U': 3, 'V': 0, 'W': 0, 'X': 0}",FALSE,On Time
INV-ZZ-2445370,SCH-ZZ-6469147,ZZ,ZZ20240421HYDAMD2299,2299.0,Airbus A321 Neo,04/21/2024,2024-04-21 01:59:00,2024-04-21 21:45:00,HYD,AMD,220.0,250,145,-75,105,22,44,66,88,26,15,7,11,53,31,13,22,74,43,23,31,98,57,31,41,"{'F': 7, 'P': 4}","{'C': 8, 'J': 8, 'Z': 6}","{'Q': 14, 'R': 6, 'S': 2, 'T': 1, 'H': 8, 'M': 0}","{'Y': 7, 'A': 6, 'B': 0, 'D': 0, 'E': 2, 'G': 5, 'I': 1, 'K': 6, 'L': 2, 'N': 1, 'O': 2, 'U': 5, 'V': 2, 'W': 0, 'X': 2}",FALSE,On Time
INV-ZZ-9633373,SCH-ZZ-7589545,ZZ,ZZ20240421MAATRV2008,2008.0,Boeing 787,04/21/2024,2024-04-21 02:25:00,2024-04-21 21:44:00,MAA,TRV,270.0,309,182,-88,127,27,54,81,108,30,18,9,12,63,37,17,26,96,57,24,39,127,75,33,52,"{'F': 7, 'P': 5}","{'C': 11, 'J': 8, 'Z': 7}","{'Q': 14, 'R': 10, 'S': 1, 'T': 3, 'H': 11, 'M': 0}","{'Y': 7, 'A': 7, 'B': 2, 'D': 4, 'E': 3, 'G': 4, 'I': 1, 'K': 8, 'L': 3, 'N': 2, 'O': 1, 'U': 5, 'V': 1, 'W': 0, 'X': 4}",TRUE,On Time
INV-ZZ-4912470,SCH-ZZ-3750409,ZZ,ZZ20240421DELBOM4516,4516.0,Boeing 767,04/21/2024,2024-04-21 05:29:00,2024-04-21 15:51:00,DEL,BOM,278.0,332,203,-75,129,27,55,83,111,31,19,8,12,66,40,15,26,99,61,22,38,125,76,35,49,"{'F': 9, 'P': 3}","{'C': 14, 'J': 7, 'Z': 5}","{'Q': 19, 'R': 7, 'S': 1, 'T': 0, 'H': 10, 'M': 1}","{'Y': 6, 'A': 7, 'B': 2, 'D': 2, 'E': 3, 'G': 6, 'I': 0, 'K': 5, 'L': 2, 'N': 4, 'O': 2, 'U': 6, 'V': 1, 'W': 2, 'X': 1}",FALSE,On Time
INV-ZZ-2545790,SCH-ZZ-3838342,ZZ,ZZ20240421HYDCCU3772,3772.0,Boeing 767,04/21/2024,2024-04-21 05:58:00,2024-04-22 03:23:00,HYD,CCU,278.0,323,193,-85,130,27,55,83,111,32,19,8,13,65,39,16,26,96,57,26,39,127,76,35,51,"{'F': 11, 'P': 2}","{'C': 10, 'J': 10, 'Z': 6}","{'Q': 19, 'R': 9, 'S': 2, 'T': 0, 'H': 9, 'M': 0}","{'Y': 3, 'A': 8, 'B': 2, 'D': 3, 'E': 0, 'G': 8, 'I': 1, 'K': 4, 'L': 2, 'N': 4, 'O': 3, 'U': 7, 'V': 3, 'W': 0, 'X': 3}",FALSE,On Time
INV-ZZ-5729937,SCH-ZZ-4701131,ZZ,ZZ20240421HYDIDR4122,4122.0,Airbus A320 Neo,04/21/2024,2024-04-21 06:08:00,2024-04-21 10:32:00,HYD,IDR,180.0,201,126,-54,75,18,36,54,72,21,13,5,8,42,26,10,16,61,38,16,23,85,53,19,32,"{'F': 5, 'P': 3}","{'C': 9, 'J': 5, 'Z': 2}","{'Q': 12, 'R': 3, 'S': 1, 'T': 0, 'H': 7, 'M': 0}","{'Y': 5, 'A': 0, 'B': 2, 'D': 1, 'E': 2, 'G': 5, 'I': 3, 'K': 2, 'L': 2, 'N': 1, 'O': 0, 'U': 3, 'V': 2, 'W': 1, 'X': 3}",FALSE,On Time
INV-ZZ-3646937,SCH-ZZ-5381276,ZZ,ZZ20240421JAIDEL3278,3278.0,Boeing 757,04/21/2024,2024-04-21 06:41:00,2024-04-22 02:14:00,JAI,DEL,209.0,239,149,-60,90,20,41,62,83,23,14,6,9,46,29,12,17,74,46,16,28,92,57,26,35,"{'F': 6, 'P': 3}","{'C': 11, 'J': 5, 'Z': 1}","{'Q': 12, 'R': 6, 'S': 3, 'T': 3, 'H': 4, 'M': 0}","{'Y': 4, 'A': 3, 'B': 2, 'D': 1, 'E': 2, 'G': 5, 'I': 0, 'K': 6, 'L': 0, 'N': 0, 'O': 3, 'U': 4, 'V': 0, 'W': 2, 'X': 3}",FALSE,On Time
INV-ZZ-5078776,SCH-ZZ-2729891,ZZ,ZZ20240421GOIMAA4516,4516.0,Airbus A320-200,04/21/2024,2024-04-21 06:48:00,2024-04-22 02:04:00,GOI,MAA,150.0,170,97,-53,73,15,30,45,60,18,10,5,8,35,20,10,15,53,30,15,23,67,38,22,29,"{'F': 4, 'P': 4}","{'C': 9, 'J': 3, 'Z': 3}","{'Q': 10, 'R': 6, 'S': 2, 'T': 0, 'H': 5, 'M': 0}","{'Y': 2, 'A': 4, 'B': 2, 'D': 2, 'E': 1, 'G': 4, 'I': 2, 'K': 2, 'L': 1, 'N': 0, 'O': 2, 'U': 4, 'V': 1, 'W': 0, 'X': 2}",FALSE,On Time
INV-ZZ-6808081,SCH-ZZ-3820040,ZZ,ZZ20240421MAATRV2047,2047.0,Boeing 767,04/21/2024,2024-04-21 07:41:00,2024-04-22 02:50:00,MAA,TRV,278.0,333,198,-80,135,27,55,83,111,31,18,9,13,62,37,18,25,92,55,28,37,130,77,34,53,"{'F': 4, 'P': 9}","{'C': 12, 'J': 4, 'Z': 9}","{'Q': 18, 'R': 5, 'S': 0, 'T': 0, 'H': 12, 'M': 2}","{'Y': 5, 'A': 7, 'B': 3, 'D': 2, 'E': 0, 'G': 8, 'I': 1, 'K': 7, 'L': 0, 'N': 3, 'O': 1, 'U': 7, 'V': 3, 'W': 3, 'X': 3}",TRUE,On Time
INV-ZZ-8001851,SCH-ZZ-4227852,ZZ,ZZ20240421GOIBOM2453,2453.0,Airbus A320 Neo,04/21/2024,2024-04-21 08:27:00,2024-04-21 13:54:00,GOI,BOM,180.0,215,129,-51,86,18,36,54,72,21,13,5,8,43,26,10,17,61,37,17,24,83,50,22,33,"{'F': 5, 'P': 3}","{'C': 7, 'J': 5, 'Z': 5}","{'Q': 7, 'R': 4, 'S': 2, 'T': 0, 'H': 9, 'M': 2}","{'Y': 4, 'A': 2, 'B': 3, 'D': 0, 'E': 2, 'G': 2, 'I': 2, 'K': 5, 'L': 2, 'N': 2, 'O': 2, 'U': 4, 'V': 2, 'W': 0, 'X': 1}",TRUE,On Time
INV-ZZ-6031249,SCH-ZZ-7588562,ZZ,ZZ20240421AMDDEL3688,3688.0,Airbus A321-200,04/21/2024,2024-04-21 10:53:00,2024-04-21 19:22:00,AMD,DEL,200.0,225,134,-66,91,20,40,60,80,23,14,6,9,47,28,12,19,69,41,19,28,93,55,25,38,"{'F': 7, 'P': 2}","{'C': 10, 'J': 4, 'Z': 5}","{'Q': 16, 'R': 3, 'S': 1, 'T': 2, 'H': 1, 'M': 5}","{'Y': 6, 'A': 6, 'B': 1, 'D': 0, 'E': 2, 'G': 5, 'I': 0, 'K': 6, 'L': 1, 'N': 2, 'O': 1, 'U': 4, 'V': 2, 'W': 0, 'X': 2}",FALSE,On Time
INV-ZZ-4137684,SCH-ZZ-3249150,ZZ,ZZ20240421BOMAMD4704,4704.0,BAe 146,04/21/2024,2024-04-21 13:45:00,2024-04-21 19:31:00,BOM,AMD,91.0,109,63,-28,46,9,18,27,36,11,6,3,5,20,12,6,8,32,19,8,13,40,23,13,17,"{'F': 2, 'P': 3}","{'C': 2, 'J': 4, 'Z': 2}","{'Q': 4, 'R': 5, 'S': 1, 'T': 0, 'H': 1, 'M': 2}","{'Y': 3, 'A': 2, 'B': 0, 'D': 1, 'E': 1, 'G': 2, 'I': 1, 'K': 2, 'L': 0, 'N': 0, 'O': 0, 'U': 3, 'V': 1, 'W': 0, 'X': 1}",TRUE,On Time
INV-ZZ-6330205,SCH-ZZ-4843596,ZZ,ZZ20240421AMDBLR3041,3041.0,Airbus A321-200,04/21/2024,2024-04-21 14:26:00,2024-04-21 18:12:00,AMD,BLR,200.0,222,132,-68,90,20,40,60,80,24,14,6,10,47,28,12,19,68,40,20,28,88,52,28,36,"{'F': 7, 'P': 3}","{'C': 5, 'J': 8, 'Z': 6}","{'Q': 12, 'R': 3, 'S': 1, 'T': 1, 'H': 8, 'M': 3}","{'Y': 4, 'A': 6, 'B': 2, 'D': 3, 'E': 2, 'G': 4, 'I': 1, 'K': 4, 'L': 0, 'N': 2, 'O': 0, 'U': 6, 'V': 0, 'W': 1, 'X': 1}",TRUE,On Time
INV-ZZ-9258559,SCH-ZZ-5840327,ZZ,ZZ20240421IDRHYD2795,2795.0,Airbus A321 Neo,04/21/2024,2024-04-21 14:29:00,2024-04-22 02:10:00,IDR,HYD,220.0,244,132,-88,112,22,44,66,88,25,14,8,11,49,27,17,22,75,41,25,34,104,56,32,48,"{'F': 6, 'P': 5}","{'C': 11, 'J': 5, 'Z': 6}","{'Q': 17, 'R': 6, 'S': 5, 'T': 2, 'H': 3, 'M': 1}","{'Y': 6, 'A': 7, 'B': 2, 'D': 2, 'E': 1, 'G': 7, 'I': 1, 'K': 5, 'L': 2, 'N': 1, 'O': 1, 'U': 7, 'V': 2, 'W': 3, 'X': 1}",FALSE,On Time
INV-ZZ-1979920,SCH-ZZ-8796700,ZZ,ZZ20240421CCUBLR3294,3294.0,Airbus A320-200,04/21/2024,2024-04-21 14:54:00,2024-04-22 11:38:00,CCU,BLR,150.0,172,95,-55,77,15,30,45,60,18,10,5,8,36,20,10,16,53,29,16,24,70,39,21,31,"{'F': 5, 'P': 3}","{'C': 9, 'J': 3, 'Z': 4}","{'Q': 11, 'R': 4, 'S': 1, 'T': 0, 'H': 6, 'M': 2}","{'Y': 4, 'A': 4, 'B': 2, 'D': 2, 'E': 2, 'G': 3, 'I': 1, 'K': 2, 'L': 2, 'N': 2, 'O': 0, 'U': 2, 'V': 2, 'W': 1, 'X': 2}",TRUE,On Time
INV-ZZ-4699908,SCH-ZZ-9748991,ZZ,ZZ20240421MAABOM3117,3117.0,ATR 72,04/21/2024,2024-04-21 15:49:00,2024-04-21 21:43:00,MAA,BOM,72.0,86,51,-21,35,7,14,21,28,8,5,2,3,16,9,5,7,24,14,7,10,32,19,9,13,"{'F': 3, 'P': 0}","{'C': 4, 'J': 2, 'Z': 1}","{'Q': 4, 'R': 3, 'S': 1, 'T': 1, 'H': 0, 'M': 1}","{'Y': 2, 'A': 1, 'B': 1, 'D': 0, 'E': 0, 'G': 1, 'I': 1, 'K': 1, 'L': 1, 'N': 1, 'O': 1, 'U': 1, 'V': 1, 'W': 1, 'X': 0}",TRUE,On Time
INV-ZZ-9747842,SCH-ZZ-7068651,ZZ,ZZ20240421CCUHYD3723,3723.0,Boeing 787,04/21/2024,2024-04-21 16:19:00,2024-04-22 00:54:00,CCU,HYD,270.0,300,187,-83,113,27,54,81,108,30,19,8,11,61,38,16,23,96,60,21,36,128,80,28,48,"{'F': 8, 'P': 3}","{'C': 14, 'J': 5, 'Z': 4}","{'Q': 18, 'R': 6, 'S': 0, 'T': 0, 'H': 12, 'M': 0}","{'Y': 5, 'A': 4, 'B': 0, 'D': 2, 'E': 4, 'G': 8, 'I': 1, 'K': 4, 'L': 1, 'N': 4, 'O': 3, 'U': 6, 'V': 3, 'W': 1, 'X': 2}",TRUE,On Time
INV-ZZ-5347107,SCH-ZZ-1589980,ZZ,ZZ20240421BOMDEL2019,2019.0,Airbus A320 Neo,04/21/2024,2024-04-21 16:42:00,2024-04-22 04:40:00,BOM,DEL,180.0,203,116,-64,87,18,36,54,72,21,12,6,9,42,24,12,18,61,35,19,26,81,46,26,35,"{'F': 5, 'P': 4}","{'C': 10, 'J': 1, 'Z': 7}","{'Q': 10, 'R': 6, 'S': 0, 'T': 1, 'H': 6, 'M': 3}","{'Y': 4, 'A': 4, 'B': 0, 'D': 1, 'E': 0, 'G': 5, 'I': 3, 'K': 4, 'L': 3, 'N': 1, 'O': 2, 'U': 4, 'V': 2, 'W': 1, 'X': 1}",FALSE,On Time
INV-ZZ-5744100,SCH-ZZ-4269181,ZZ,ZZ20240421MAACJB2885,2885.0,Boeing 777,04/21/2024,2024-04-21 17:43:00,2024-04-22 09:14:00,MAA,CJB,425.0,492,296,-129,196,42,85,127,170,48,29,13,19,96,58,27,38,147,88,39,59,193,116,54,77,"{'F': 17, 'P': 2}","{'C': 14, 'J': 11, 'Z': 13}","{'Q': 28, 'R': 16, 'S': 3, 'T': 1, 'H': 11, 'M': 0}","{'Y': 10, 'A': 10, 'B': 5, 'D': 0, 'E': 1, 'G': 10, 'I': 4, 'K': 8, 'L': 4, 'N': 2, 'O': 4, 'U': 9, 'V': 3, 'W': 5, 'X': 2}",FALSE,On Time
INV-ZZ-5712543,SCH-ZZ-4253453,ZZ,ZZ20240421AMDMAA4012,4012.0,Boeing 757,04/21/2024,2024-04-21 19:00:00,2024-04-21 22:08:00,AMD,MAA,209.0,237,147,-62,90,20,41,62,83,23,14,6,9,46,28,13,18,74,46,16,28,98,61,22,37,"{'F': 6, 'P': 3}","{'C': 9, 'J': 5, 'Z': 4}","{'Q': 14, 'R': 5, 'S': 1, 'T': 0, 'H': 7, 'M': 1}","{'Y': 4, 'A': 6, 'B': 0, 'D': 2, 'E': 3, 'G': 4, 'I': 0, 'K': 5, 'L': 0, 'N': 2, 'O': 2, 'U': 4, 'V': 1, 'W': 3, 'X': 1}",FALSE,On Time
INV-ZZ-6246289,SCH-ZZ-6095474,ZZ,ZZ20240421HYDAMD3723,3723.0,Airbus A320 Neo,04/21/2024,2024-04-21 20:40:00,2024-04-22 12:24:00,HYD,AMD,180.0,211,129,-51,82,18,36,54,72,21,13,5,8,41,25,11,16,60,37,17,23,82,50,22,32,"{'F': 7, 'P': 1}","{'C': 9, 'J': 3, 'Z': 4}","{'Q': 13, 'R': 1, 'S': 2, 'T': 0, 'H': 7, 'M': 0}","{'Y': 5, 'A': 1, 'B': 0, 'D': 2, 'E': 1, 'G': 5, 'I': 0, 'K': 3, 'L': 2, 'N': 2, 'O': 0, 'U': 4, 'V': 3, 'W': 1, 'X': 3}",FALSE,On Time
INV-ZZ-2551576,SCH-ZZ-1216883,ZZ,ZZ20240421DELBLR3152,3152.0,Boeing 777,04/21/2024,2024-04-21 21:06:00,2024-04-22 16:58:00,DEL,BLR,425.0,506,278,-147,228,42,85,127,170,48,26,16,22,99,54,31,45,145,80,47,65,192,105,65,87,"{'F': 18, 'P': 4}","{'C': 22, 'J': 16, 'Z': 7}","{'Q': 29, 'R': 14, 'S': 0, 'T': 5, 'H': 16, 'M': 1}","{'Y': 10, 'A': 10, 'B': 4, 'D': 3, 'E': 6, 'G': 9, 'I': 1, 'K': 10, 'L': 4, 'N': 6, 'O': 5, 'U': 12, 'V': 2, 'W': 1, 'X': 4}",FALSE,On Time
INV-ZZ-5131275,SCH-ZZ-2404944,ZZ,ZZ20240421PNQGAU4614,4614.0,Airbus A320-200,04/21/2024,2024-04-21 23:31:00,2024-04-22 23:12:00,PNQ,GAU,150.0,170,95,-55,75,15,30,45,60,17,10,5,7,35,20,10,15,51,29,16,22,70,39,21,31,"{'F': 5, 'P': 2}","{'C': 10, 'J': 3, 'Z': 2}","{'Q': 10, 'R': 4, 'S': 0, 'T': 1, 'H': 6, 'M': 1}","{'Y': 2, 'A': 4, 'B': 1, 'D': 2, 'E': 2, 'G': 3, 'I': 2, 'K': 3, 'L': 1, 'N': 1, 'O': 2, 'U': 4, 'V': 1, 'W': 2, 'X': 1}",FALSE,On Time
INV-ZZ-8827627,SCH-ZZ-5041804,ZZ,ZZ20240421HYDCJB2880,2880.0,ATR 72,04/21/2024,2024-04-21 23:47:00,2024-04-22 13:44:00,HYD,CJB,72.0,85,49,-23,36,7,14,21,28,8,5,2,3,16,9,5,7,24,14,7,10,31,18,10,13,"{'F': 2, 'P': 1}","{'C': 2, 'J': 3, 'Z': 2}","{'Q': 4, 'R': 2, 'S': 0, 'T': 2, 'H': 2, 'M': 0}","{'Y': 0, 'A': 2, 'B': 1, 'D': 0, 'E': 1, 'G': 0, 'I': 1, 'K': 1, 'L': 1, 'N': 1, 'O': 0, 'U': 2, 'V': 1, 'W': 1, 'X': 1}",TRUE,On Time
INV-ZZ-9764243,SCH-ZZ-1367492,ZZ,ZZ20240422MAABOM3229,3229.0,Airbus A320 Neo,04/22/2024,2024-04-22 00:52:00,2024-04-22 23:19:00,MAA,BOM,180.0,208,127,-53,81,18,36,54,72,20,12,6,8,40,25,11,15,61,37,17,24,86,53,19,33,"{'F': 6, 'P': 2}","{'C': 8, 'J': 6, 'Z': 1}","{'Q': 14, 'R': 5, 'S': 0, 'T': 0, 'H': 5, 'M': 0}","{'Y': 3, 'A': 4, 'B': 0, 'D': 3, 'E': 2, 'G': 5, 'I': 0, 'K': 4, 'L': 1, 'N': 0, 'O': 2, 'U': 4, 'V': 2, 'W': 2, 'X': 1}",FALSE,On Time
INV-ZZ-1060880,SCH-ZZ-9212586,ZZ,ZZ20240422AMDDEL3431,3431.0,Airbus A321-200,04/22/2024,2024-04-22 01:10:00,2024-04-22 07:07:00,AMD,DEL,200.0,224,120,-80,104,20,40,60,80,23,12,8,11,47,25,15,22,68,36,24,32,90,48,32,42,"{'F': 7, 'P': 4}","{'C': 10, 'J': 5, 'Z': 7}","{'Q': 16, 'R': 5, 'S': 1, 'T': 0, 'H': 10, 'M': 0}","{'Y': 5, 'A': 3, 'B': 3, 'D': 2, 'E': 1, 'G': 6, 'I': 1, 'K': 6, 'L': 1, 'N': 1, 'O': 2, 'U': 5, 'V': 3, 'W': 1, 'X': 2}",FALSE,On Time
INV-ZZ-6682544,SCH-ZZ-7145989,ZZ,ZZ20240422HYDCJB2914,2914.0,Boeing 787,04/22/2024,2024-04-22 01:16:00,2024-04-22 09:23:00,HYD,CJB,270.0,307,186,-84,121,27,54,81,108,32,19,8,13,63,38,16,25,90,55,26,35,122,74,34,48,"{'F': 6, 'P': 7}","{'C': 5, 'J': 11, 'Z': 9}","{'Q': 16, 'R': 8, 'S': 2, 'T': 0, 'H': 6, 'M': 3}","{'Y': 7, 'A': 8, 'B': 2, 'D': 0, 'E': 1, 'G': 6, 'I': 0, 'K': 7, 'L': 2, 'N': 0, 'O': 3, 'U': 8, 'V': 1, 'W': 2, 'X': 1}",FALSE,On Time
INV-ZZ-7260164,SCH-ZZ-3930555,ZZ,ZZ20240422JAILKO4478,4478.0,Airbus A321-200,04/22/2024,2024-04-22 01:47:00,2024-04-22 19:45:00,JAI,LKO,200.0,220,125,-75,95,20,40,60,80,24,14,6,10,47,27,13,20,67,38,22,29,91,52,28,39,"{'F': 7, 'P': 3}","{'C': 9, 'J': 5, 'Z': 6}","{'Q': 13, 'R': 3, 'S': 0, 'T': 4, 'H': 5, 'M': 4}","{'Y': 6, 'A': 4, 'B': 2, 'D': 1, 'E': 1, 'G': 5, 'I': 0, 'K': 5, 'L': 1, 'N': 3, 'O': 1, 'U': 6, 'V': 1, 'W': 2, 'X': 1}",FALSE,On Time
INV-ZZ-6621713,SCH-ZZ-6469147,ZZ,ZZ20240422HYDAMD2299,2299.0,Airbus A321 Neo,04/22/2024,2024-04-22 01:59:00,2024-04-22 21:45:00,HYD,AMD,220.0,262,158,-62,104,22,44,66,88,26,16,6,10,53,32,12,21,74,45,21,29,102,62,26,40,"{'F': 5, 'P': 5}","{'C': 11, 'J': 5, 'Z': 5}","{'Q': 14, 'R': 7, 'S': 0, 'T': 3, 'H': 5, 'M': 0}","{'Y': 3, 'A': 2, 'B': 3, 'D': 3, 'E': 1, 'G': 4, 'I': 2, 'K': 7, 'L': 0, 'N': 2, 'O': 1, 'U': 5, 'V': 2, 'W': 2, 'X': 3}",FALSE,On Time
INV-ZZ-1879246,SCH-ZZ-3750409,ZZ,ZZ20240422DELBOM4516,4516.0,Boeing 767,04/22/2024,2024-04-22 05:29:00,2024-04-22 15:51:00,DEL,BOM,278.0,318,193,-85,125,27,55,83,111,30,18,9,12,63,38,17,25,91,55,28,36,127,77,34,50,"{'F': 12, 'P': 0}","{'C': 13, 'J': 4, 'Z': 8}","{'Q': 21, 'R': 4, 'S': 0, 'T': 0, 'H': 11, 'M': 0}","{'Y': 6, 'A': 4, 'B': 2, 'D': 2, 'E': 2, 'G': 5, 'I': 4, 'K': 8, 'L': 2, 'N': 0, 'O': 2, 'U': 8, 'V': 0, 'W': 3, 'X': 2}",FALSE,On Time
INV-ZZ-8797786,SCH-ZZ-4701131,ZZ,ZZ20240422HYDIDR4122,4122.0,Airbus A320 Neo,04/22/2024,2024-04-22 06:08:00,2024-04-22 10:32:00,HYD,IDR,180.0,199,109,-71,90,18,36,54,72,20,11,7,9,40,22,14,18,60,33,21,27,83,45,27,38,"{'F': 6, 'P': 3}","{'C': 7, 'J': 4, 'Z': 7}","{'Q': 8, 'R': 7, 'S': 3, 'T': 0, 'H': 9, 'M': 0}","{'Y': 5, 'A': 5, 'B': 2, 'D': 0, 'E': 2, 'G': 3, 'I': 3, 'K': 4, 'L': 1, 'N': 1, 'O': 2, 'U': 3, 'V': 2, 'W': 2, 'X': 3}",TRUE,On Time
INV-ZZ-9379786,SCH-ZZ-5381276,ZZ,ZZ20240422JAIDEL3278,3278.0,Boeing 757,04/22/2024,2024-04-22 06:41:00,2024-04-23 02:14:00,JAI,DEL,209.0,233,127,-82,106,20,41,62,83,24,13,7,11,47,26,15,21,74,40,22,34,92,50,33,42,"{'F': 8, 'P': 3}","{'C': 10, 'J': 5, 'Z': 6}","{'Q': 12, 'R': 5, 'S': 3, 'T': 3, 'H': 9, 'M': 2}","{'Y': 6, 'A': 3, 'B': 2, 'D': 2, 'E': 1, 'G': 4, 'I': 2, 'K': 4, 'L': 2, 'N': 1, 'O': 3, 'U': 6, 'V': 1, 'W': 3, 'X': 2}",FALSE,On Time
INV-ZZ-1957001,SCH-ZZ-6544056,ZZ,ZZ20240422BOMDEL3869,3869.0,BAe 146,04/22/2024,2024-04-22 07:20:00,2024-04-22 09:24:00,BOM,DEL,91.0,106,66,-25,40,9,18,27,36,11,7,2,4,22,14,4,8,30,19,8,11,42,26,10,16,"{'F': 3, 'P': 1}","{'C': 4, 'J': 2, 'Z': 2}","{'Q': 3, 'R': 2, 'S': 0, 'T': 2, 'H': 1, 'M': 3}","{'Y': 2, 'A': 3, 'B': 1, 'D': 1, 'E': 0, 'G': 2, 'I': 1, 'K': 1, 'L': 0, 'N': 0, 'O': 1, 'U': 2, 'V': 1, 'W': 0, 'X': 1}",TRUE,On Time
INV-ZZ-7114199,SCH-ZZ-3820040,ZZ,ZZ20240422MAATRV2047,2047.0,Boeing 767,04/22/2024,2024-04-22 07:41:00,2024-04-23 02:50:00,MAA,TRV,278.0,311,171,-107,140,27,55,83,111,31,17,10,14,65,36,19,29,92,51,32,41,127,70,41,57,"{'F': 9, 'P': 5}","{'C': 12, 'J': 9, 'Z': 8}","{'Q': 19, 'R': 6, 'S': 2, 'T': 1, 'H': 13, 'M': 0}","{'Y': 5, 'A': 8, 'B': 3, 'D': 1, 'E': 2, 'G': 6, 'I': 2, 'K': 6, 'L': 4, 'N': 3, 'O': 2, 'U': 7, 'V': 3, 'W': 1, 'X': 4}",TRUE,On Time
INV-ZZ-3950022,SCH-ZZ-3249150,ZZ,ZZ20240422BOMAMD4704,4704.0,BAe 146,04/22/2024,2024-04-22 13:45:00,2024-04-22 19:31:00,BOM,AMD,91.0,103,62,-29,41,9,18,27,36,11,7,2,4,21,13,5,8,31,19,8,12,40,24,12,16,"{'F': 2, 'P': 2}","{'C': 5, 'J': 1, 'Z': 2}","{'Q': 4, 'R': 4, 'S': 0, 'T': 0, 'H': 3, 'M': 1}","{'Y': 1, 'A': 2, 'B': 1, 'D': 0, 'E': 0, 'G': 3, 'I': 1, 'K': 3, 'L': 0, 'N': 1, 'O': 0, 'U': 3, 'V': 0, 'W': 0, 'X': 1}",FALSE,On Time
INV-ZZ-7856630,SCH-ZZ-4843596,ZZ,ZZ20240422AMDBLR3041,3041.0,Airbus A321-200,04/22/2024,2024-04-22 14:26:00,2024-04-22 18:12:00,AMD,BLR,200.0,233,129,-71,104,20,40,60,80,24,13,7,11,44,24,16,20,68,38,22,30,93,52,28,41,"{'F': 8, 'P': 3}","{'C': 9, 'J': 7, 'Z': 4}","{'Q': 12, 'R': 8, 'S': 2, 'T': 0, 'H': 6, 'M': 2}","{'Y': 4, 'A': 3, 'B': 0, 'D': 2, 'E': 1, 'G': 5, 'I': 3, 'K': 4, 'L': 2, 'N': 2, 'O': 2, 'U': 6, 'V': 2, 'W': 3, 'X': 2}",FALSE,On Time
INV-ZZ-5036865,SCH-ZZ-8796700,ZZ,ZZ20240422CCUBLR3294,3294.0,Airbus A320-200,04/22/2024,2024-04-22 14:54:00,2024-04-23 11:38:00,CCU,BLR,150.0,171,101,-49,70,15,30,45,60,18,11,4,7,35,21,9,14,51,30,15,21,72,43,17,29,"{'F': 7, 'P': 0}","{'C': 2, 'J': 4, 'Z': 8}","{'Q': 9, 'R': 7, 'S': 0, 'T': 0, 'H': 5, 'M': 0}","{'Y': 3, 'A': 3, 'B': 2, 'D': 1, 'E': 0, 'G': 3, 'I': 2, 'K': 4, 'L': 1, 'N': 2, 'O': 2, 'U': 2, 'V': 2, 'W': 0, 'X': 2}",FALSE,On Time
INV-ZZ-7992152,SCH-ZZ-9117133,ZZ,ZZ20240422BLRCCU2504,2504.0,Boeing 777,04/22/2024,2024-04-22 15:35:00,2024-04-22 18:17:00,BLR,CCU,425.0,491,265,-160,226,42,85,127,170,48,26,16,22,99,53,32,46,148,80,47,68,201,109,61,92,"{'F': 16, 'P': 6}","{'C': 20, 'J': 13, 'Z': 13}","{'Q': 24, 'R': 15, 'S': 5, 'T': 6, 'H': 16, 'M': 2}","{'Y': 13, 'A': 12, 'B': 1, 'D': 6, 'E': 5, 'G': 12, 'I': 4, 'K': 10, 'L': 2, 'N': 2, 'O': 1, 'U': 11, 'V': 5, 'W': 4, 'X': 4}",FALSE,On Time
INV-ZZ-8421237,SCH-ZZ-6536717,ZZ,ZZ20240422GAUBOM2526,2526.0,Boeing 717,04/22/2024,2024-04-22 15:59:00,2024-04-23 05:45:00,GAU,BOM,100.0,116,72,-28,44,10,20,30,40,11,7,3,4,23,14,6,9,35,22,8,13,47,29,11,18,"{'F': 4, 'P': 0}","{'C': 4, 'J': 3, 'Z': 2}","{'Q': 8, 'R': 1, 'S': 1, 'T': 1, 'H': 2, 'M': 0}","{'Y': 3, 'A': 2, 'B': 1, 'D': 1, 'E': 0, 'G': 1, 'I': 0, 'K': 2, 'L': 1, 'N': 0, 'O': 0, 'U': 3, 'V': 2, 'W': 2, 'X': 0}",FALSE,On Time
INV-ZZ-4434695,SCH-ZZ-1589980,ZZ,ZZ20240422BOMDEL2019,2019.0,Airbus A320 Neo,04/22/2024,2024-04-22 16:42:00,2024-04-23 04:40:00,BOM,DEL,180.0,208,128,-52,80,18,36,54,72,20,12,6,8,43,26,10,17,62,38,16,24,83,51,21,32,"{'F': 8, 'P': 0}","{'C': 5, 'J': 5, 'Z': 7}","{'Q': 9, 'R': 6, 'S': 0, 'T': 2, 'H': 7, 'M': 0}","{'Y': 3, 'A': 4, 'B': 1, 'D': 2, 'E': 0, 'G': 5, 'I': 3, 'K': 0, 'L': 3, 'N': 2, 'O': 1, 'U': 3, 'V': 2, 'W': 3, 'X': 0}",TRUE,On Time
INV-ZZ-3994892,SCH-ZZ-2693534,ZZ,ZZ20240422MAACJB4341,4341.0,Boeing 757,04/22/2024,2024-04-22 17:09:00,2024-04-22 22:11:00,MAA,CJB,209.0,231,135,-74,96,20,41,62,83,23,13,7,10,48,28,13,20,72,42,20,30,92,54,29,38,"{'F': 10, 'P': 0}","{'C': 10, 'J': 8, 'Z': 2}","{'Q': 12, 'R': 3, 'S': 1, 'T': 2, 'H': 8, 'M': 4}","{'Y': 3, 'A': 5, 'B': 3, 'D': 0, 'E': 2, 'G': 5, 'I': 1, 'K': 4, 'L': 2, 'N': 0, 'O': 1, 'U': 6, 'V': 2, 'W': 2, 'X': 2}",FALSE,On Time
INV-ZZ-2394886,SCH-ZZ-8577412,ZZ,ZZ20240422GOIBOM4529,4529.0,Boeing 777-300,04/22/2024,2024-04-22 17:42:00,2024-04-22 19:44:00,GOI,BOM,360.0,397,243,-117,154,36,72,108,144,43,26,10,17,81,50,22,31,129,79,29,50,168,103,41,65,"{'F': 15, 'P': 2}","{'C': 16, 'J': 5, 'Z': 10}","{'Q': 25, 'R': 11, 'S': 2, 'T': 0, 'H': 12, 'M': 0}","{'Y': 10, 'A': 9, 'B': 4, 'D': 3, 'E': 4, 'G': 8, 'I': 3, 'K': 5, 'L': 0, 'N': 3, 'O': 2, 'U': 9, 'V': 3, 'W': 2, 'X': 0}",FALSE,On Time
INV-ZZ-8389900,SCH-ZZ-9337638,ZZ,ZZ20240422MAACCU4647,4647.0,Airbus A321-200,04/22/2024,2024-04-22 20:34:00,2024-04-23 17:02:00,MAA,CCU,200.0,220,126,-74,94,20,40,60,80,24,14,6,10,44,25,15,19,68,39,21,29,96,55,25,41,"{'F': 9, 'P': 1}","{'C': 8, 'J': 3, 'Z': 8}","{'Q': 13, 'R': 6, 'S': 0, 'T': 0, 'H': 8, 'M': 2}","{'Y': 5, 'A': 5, 'B': 1, 'D': 1, 'E': 2, 'G': 6, 'I': 2, 'K': 4, 'L': 2, 'N': 0, 'O': 3, 'U': 5, 'V': 1, 'W': 1, 'X': 3}",FALSE,On Time
INV-ZZ-7705578,SCH-ZZ-6980436,ZZ,ZZ20240422BOMBLR3556,3556.0,Boeing 777,04/22/2024,2024-04-22 22:10:00,2024-04-23 05:46:00,BOM,BLR,425.0,476,280,-145,196,42,85,127,170,49,29,13,20,101,59,26,42,144,85,42,59,196,115,55,81,"{'F': 12, 'P': 8}","{'C': 11, 'J': 17, 'Z': 14}","{'Q': 30, 'R': 11, 'S': 3, 'T': 0, 'H': 14, 'M': 1}","{'Y': 10, 'A': 10, 'B': 3, 'D': 3, 'E': 0, 'G': 10, 'I': 5, 'K': 13, 'L': 4, 'N': 4, 'O': 3, 'U': 11, 'V': 2, 'W': 0, 'X': 3}",FALSE,On Time
INV-ZZ-9637739,SCH-ZZ-1646787,ZZ,ZZ20240422GOIPNQ4429,4429.0,BAe 146,04/22/2024,2024-04-22 22:10:00,2024-04-23 08:41:00,GOI,PNQ,91.0,101,59,-32,42,9,18,27,36,10,6,3,4,20,12,6,8,32,19,8,13,43,25,11,18,"{'F': 4, 'P': 0}","{'C': 3, 'J': 2, 'Z': 3}","{'Q': 8, 'R': 0, 'S': 1, 'T': 0, 'H': 2, 'M': 2}","{'Y': 3, 'A': 2, 'B': 1, 'D': 0, 'E': 0, 'G': 3, 'I': 0, 'K': 2, 'L': 1, 'N': 1, 'O': 1, 'U': 2, 'V': 1, 'W': 0, 'X': 1}",FALSE,On Time
INV-ZZ-3156289,SCH-ZZ-9212586,ZZ,ZZ20240423AMDDEL3431,3431.0,Airbus A321-200,04/23/2024,2024-04-23 01:10:00,2024-04-23 07:07:00,AMD,DEL,200.0,235,128,-72,107,20,40,60,80,23,12,8,11,45,24,16,21,67,36,24,31,95,52,28,43,"{'F': 6, 'P': 5}","{'C': 6, 'J': 7, 'Z': 8}","{'Q': 16, 'R': 6, 'S': 2, 'T': 0, 'H': 4, 'M': 3}","{'Y': 4, 'A': 5, 'B': 2, 'D': 3, 'E': 1, 'G': 4, 'I': 2, 'K': 5, 'L': 3, 'N': 2, 'O': 2, 'U': 6, 'V': 2, 'W': 1, 'X': 1}",TRUE,On Time
INV-ZZ-4555986,SCH-ZZ-7145989,ZZ,ZZ20240423HYDCJB2914,2914.0,Boeing 787,04/23/2024,2024-04-23 01:16:00,2024-04-23 09:23:00,HYD,CJB,270.0,300,185,-85,115,27,54,81,108,32,20,7,12,60,37,17,23,89,55,26,34,124,76,32,48,"{'F': 10, 'P': 2}","{'C': 9, 'J': 4, 'Z': 10}","{'Q': 16, 'R': 5, 'S': 0, 'T': 4, 'H': 9, 'M': 0}","{'Y': 7, 'A': 7, 'B': 3, 'D': 0, 'E': 0, 'G': 6, 'I': 3, 'K': 5, 'L': 2, 'N': 2, 'O': 4, 'U': 6, 'V': 3, 'W': 0, 'X': 0}",FALSE,On Time
INV-ZZ-5788471,SCH-ZZ-2790389,ZZ,ZZ20240423GAUPNQ3723,3723.0,Boeing 717,04/23/2024,2024-04-23 01:26:00,2024-04-23 20:43:00,GAU,PNQ,100.0,111,65,-35,46,10,20,30,40,11,6,4,5,23,13,7,10,35,20,10,15,45,26,14,19,"{'F': 4, 'P': 1}","{'C': 6, 'J': 3, 'Z': 1}","{'Q': 6, 'R': 3, 'S': 2, 'T': 0, 'H': 4, 'M': 0}","{'Y': 1, 'A': 1, 'B': 1, 'D': 0, 'E': 0, 'G': 1, 'I': 2, 'K': 3, 'L': 2, 'N': 0, 'O': 0, 'U': 2, 'V': 2, 'W': 2, 'X': 2}",TRUE,On Time
INV-ZZ-6649525,SCH-ZZ-6469147,ZZ,ZZ20240423HYDAMD2299,2299.0,Airbus A321 Neo,04/23/2024,2024-04-23 01:59:00,2024-04-23 21:45:00,HYD,AMD,220.0,255,144,-76,111,22,44,66,88,24,14,8,10,49,28,16,21,76,43,23,33,98,56,32,42,"{'F': 7, 'P': 3}","{'C': 12, 'J': 8, 'Z': 1}","{'Q': 14, 'R': 10, 'S': 2, 'T': 1, 'H': 5, 'M': 1}","{'Y': 5, 'A': 5, 'B': 0, 'D': 3, 'E': 2, 'G': 6, 'I': 2, 'K': 4, 'L': 1, 'N': 2, 'O': 2, 'U': 5, 'V': 1, 'W': 1, 'X': 3}",TRUE,On Time
INV-ZZ-1594157,SCH-ZZ-7589545,ZZ,ZZ20240423MAATRV2008,2008.0,Boeing 787,04/23/2024,2024-04-23 02:25:00,2024-04-23 21:44:00,MAA,TRV,270.0,307,179,-91,128,27,54,81,108,32,19,8,13,65,38,16,27,97,56,25,41,124,72,36,52,"{'F': 8, 'P': 5}","{'C': 13, 'J': 7, 'Z': 7}","{'Q': 19, 'R': 9, 'S': 0, 'T': 1, 'H': 11, 'M': 1}","{'Y': 8, 'A': 7, 'B': 1, 'D': 2, 'E': 3, 'G': 8, 'I': 0, 'K': 3, 'L': 1, 'N': 3, 'O': 2, 'U': 5, 'V': 2, 'W': 3, 'X': 4}",TRUE,On Time
INV-ZZ-8720109,SCH-ZZ-3838342,ZZ,ZZ20240423HYDCCU3772,3772.0,Boeing 767,04/23/2024,2024-04-23 05:58:00,2024-04-24 03:23:00,HYD,CCU,278.0,316,191,-87,125,27,55,83,111,31,19,8,12,64,39,16,25,92,56,27,36,125,76,35,49,"{'F': 8, 'P': 4}","{'C': 12, 'J': 7, 'Z': 6}","{'Q': 9, 'R': 10, 'S': 0, 'T': 1, 'H': 15, 'M': 1}","{'Y': 6, 'A': 5, 'B': 3, 'D': 1, 'E': 4, 'G': 5, 'I': 1, 'K': 7, 'L': 0, 'N': 0, 'O': 3, 'U': 8, 'V': 2, 'W': 2, 'X': 2}",TRUE,On Time
INV-ZZ-7958612,SCH-ZZ-5381276,ZZ,ZZ20240423JAIDEL3278,3278.0,Boeing 757,04/23/2024,2024-04-23 06:41:00,2024-04-24 02:14:00,JAI,DEL,209.0,242,138,-71,104,20,41,62,83,24,14,6,10,49,28,13,21,68,39,23,29,91,52,31,39,"{'F': 8, 'P': 2}","{'C': 9, 'J': 6, 'Z': 6}","{'Q': 10, 'R': 3, 'S': 4, 'T': 0, 'H': 9, 'M': 3}","{'Y': 6, 'A': 3, 'B': 1, 'D': 3, 'E': 1, 'G': 5, 'I': 2, 'K': 3, 'L': 2, 'N': 2, 'O': 2, 'U': 3, 'V': 3, 'W': 2, 'X': 1}",TRUE,On Time
INV-ZZ-2066666,SCH-ZZ-2590363,ZZ,ZZ20240423HYDDEL2294,2294.0,Boeing 757,04/23/2024,2024-04-23 06:49:00,2024-04-24 06:20:00,HYD,DEL,209.0,245,138,-71,107,20,41,62,83,24,14,6,10,49,28,13,21,70,39,23,31,99,56,27,43,"{'F': 7, 'P': 3}","{'C': 12, 'J': 6, 'Z': 3}","{'Q': 15, 'R': 4, 'S': 0, 'T': 2, 'H': 7, 'M': 3}","{'Y': 4, 'A': 3, 'B': 3, 'D': 1, 'E': 2, 'G': 6, 'I': 2, 'K': 5, 'L': 3, 'N': 1, 'O': 3, 'U': 5, 'V': 3, 'W': 0, 'X': 2}",TRUE,On Time
INV-ZZ-3400872,SCH-ZZ-4227852,ZZ,ZZ20240423GOIBOM2453,2453.0,Airbus A320 Neo,04/23/2024,2024-04-23 08:27:00,2024-04-23 13:54:00,GOI,BOM,180.0,212,128,-52,84,18,36,54,72,20,12,6,8,42,25,11,17,62,37,17,25,84,51,21,33,"{'F': 3, 'P': 5}","{'C': 6, 'J': 6, 'Z': 5}","{'Q': 11, 'R': 8, 'S': 3, 'T': 0, 'H': 3, 'M': 0}","{'Y': 3, 'A': 1, 'B': 0, 'D': 0, 'E': 3, 'G': 5, 'I': 1, 'K': 1, 'L': 2, 'N': 3, 'O': 2, 'U': 5, 'V': 1, 'W': 3, 'X': 3}",TRUE,On Time
INV-ZZ-9746570,SCH-ZZ-5840327,ZZ,ZZ20240423IDRHYD2795,2795.0,Airbus A321 Neo,04/23/2024,2024-04-23 14:29:00,2024-04-24 02:10:00,IDR,HYD,220.0,257,139,-81,118,22,44,66,88,26,14,8,12,50,27,17,23,79,43,23,36,105,57,31,48,"{'F': 6, 'P': 6}","{'C': 10, 'J': 10, 'Z': 3}","{'Q': 14, 'R': 7, 'S': 5, 'T': 2, 'H': 6, 'M': 2}","{'Y': 7, 'A': 5, 'B': 0, 'D': 2, 'E': 2, 'G': 6, 'I': 2, 'K': 6, 'L': 3, 'N': 2, 'O': 3, 'U': 5, 'V': 2, 'W': 1, 'X': 2}",FALSE,On Time
INV-ZZ-3342280,SCH-ZZ-8796700,ZZ,ZZ20240423CCUBLR3294,3294.0,Airbus A320-200,04/23/2024,2024-04-23 14:54:00,2024-04-24 11:38:00,CCU,BLR,150.0,168,101,-49,67,15,30,45,60,18,11,4,7,35,21,9,14,53,32,13,21,70,42,18,28,"{'F': 5, 'P': 2}","{'C': 7, 'J': 3, 'Z': 4}","{'Q': 10, 'R': 3, 'S': 0, 'T': 1, 'H': 7, 'M': 0}","{'Y': 3, 'A': 4, 'B': 0, 'D': 2, 'E': 1, 'G': 4, 'I': 2, 'K': 3, 'L': 0, 'N': 1, 'O': 0, 'U': 4, 'V': 2, 'W': 1, 'X': 1}",FALSE,On Time
INV-ZZ-3983574,SCH-ZZ-9117133,ZZ,ZZ20240423BLRCCU2504,2504.0,Boeing 777,04/23/2024,2024-04-23 15:35:00,2024-04-23 18:17:00,BLR,CCU,425.0,507,276,-149,231,42,85,127,170,50,27,15,23,102,55,30,47,150,82,45,68,197,107,63,90,"{'F': 17, 'P': 6}","{'C': 22, 'J': 13, 'Z': 12}","{'Q': 30, 'R': 12, 'S': 5, 'T': 0, 'H': 15, 'M': 6}","{'Y': 9, 'A': 11, 'B': 3, 'D': 4, 'E': 4, 'G': 12, 'I': 3, 'K': 10, 'L': 5, 'N': 5, 'O': 4, 'U': 12, 'V': 5, 'W': 1, 'X': 2}",FALSE,On Time
INV-ZZ-8136713,SCH-ZZ-9748991,ZZ,ZZ20240423MAABOM3117,3117.0,ATR 72,04/23/2024,2024-04-23 15:49:00,2024-04-23 21:43:00,MAA,BOM,72.0,81,50,-22,31,7,14,21,28,8,5,2,3,16,10,4,6,24,15,6,9,32,20,8,12,"{'F': 3, 'P': 0}","{'C': 5, 'J': 0, 'Z': 1}","{'Q': 4, 'R': 1, 'S': 0, 'T': 1, 'H': 2, 'M': 1}","{'Y': 2, 'A': 2, 'B': 0, 'D': 0, 'E': 0, 'G': 1, 'I': 0, 'K': 1, 'L': 1, 'N': 1, 'O': 1, 'U': 0, 'V': 1, 'W': 1, 'X': 1}",TRUE,On Time
INV-ZZ-9740489,SCH-ZZ-6536717,ZZ,ZZ20240423GAUBOM2526,2526.0,Boeing 717,04/23/2024,2024-04-23 15:59:00,2024-04-24 05:45:00,GAU,BOM,100.0,117,70,-30,47,10,20,30,40,11,7,3,4,24,14,6,10,34,20,10,14,45,27,13,18,"{'F': 2, 'P': 2}","{'C': 3, 'J': 3, 'Z': 4}","{'Q': 8, 'R': 3, 'S': 0, 'T': 0, 'H': 3, 'M': 0}","{'Y': 0, 'A': 2, 'B': 1, 'D': 0, 'E': 1, 'G': 0, 'I': 1, 'K': 3, 'L': 1, 'N': 2, 'O': 2, 'U': 3, 'V': 0, 'W': 1, 'X': 1}",TRUE,On Time
INV-ZZ-2036984,SCH-ZZ-9040445,ZZ,ZZ20240423CCUBOM3274,3274.0,Boeing 717,04/23/2024,2024-04-23 19:38:00,2024-04-24 06:17:00,CCU,BOM,100.0,118,67,-33,51,10,20,30,40,11,6,4,5,23,13,7,10,33,19,11,14,46,26,14,20,"{'F': 3, 'P': 2}","{'C': 5, 'J': 2, 'Z': 3}","{'Q': 6, 'R': 4, 'S': 0, 'T': 0, 'H': 4, 'M': 0}","{'Y': 0, 'A': 1, 'B': 2, 'D': 2, 'E': 1, 'G': 2, 'I': 0, 'K': 2, 'L': 2, 'N': 2, 'O': 0, 'U': 3, 'V': 2, 'W': 1, 'X': 0}",TRUE,On Time
INV-ZZ-7732668,SCH-ZZ-9337638,ZZ,ZZ20240423MAACCU4647,4647.0,Airbus A321-200,04/23/2024,2024-04-23 20:34:00,2024-04-24 17:02:00,MAA,CCU,200.0,229,124,-76,105,20,40,60,80,24,13,7,11,46,25,15,21,67,36,24,31,90,49,31,41,"{'F': 8, 'P': 3}","{'C': 7, 'J': 8, 'Z': 6}","{'Q': 11, 'R': 11, 'S': 0, 'T': 2, 'H': 7, 'M': 0}","{'Y': 5, 'A': 5, 'B': 1, 'D': 1, 'E': 2, 'G': 4, 'I': 1, 'K': 4, 'L': 3, 'N': 2, 'O': 3, 'U': 4, 'V': 1, 'W': 3, 'X': 2}",FALSE,On Time
INV-ZZ-8422670,SCH-ZZ-1216883,ZZ,ZZ20240423DELBLR3152,3152.0,Boeing 777,04/23/2024,2024-04-23 21:06:00,2024-04-24 16:58:00,DEL,BLR,425.0,482,279,-146,203,42,85,127,170,49,28,14,21,100,58,27,42,141,82,45,59,191,110,60,81,"{'F': 18, 'P': 3}","{'C': 21, 'J': 12, 'Z': 9}","{'Q': 23, 'R': 12, 'S': 6, 'T': 3, 'H': 15, 'M': 0}","{'Y': 10, 'A': 9, 'B': 2, 'D': 3, 'E': 5, 'G': 9, 'I': 2, 'K': 10, 'L': 4, 'N': 3, 'O': 3, 'U': 12, 'V': 5, 'W': 0, 'X': 4}",FALSE,On Time
INV-ZZ-3227855,SCH-ZZ-6980436,ZZ,ZZ20240423BOMBLR3556,3556.0,Boeing 777,04/23/2024,2024-04-23 22:10:00,2024-04-24 05:46:00,BOM,BLR,425.0,504,312,-113,192,42,85,127,170,48,30,12,18,94,58,27,36,144,89,38,55,201,124,46,77,"{'F': 13, 'P': 5}","{'C': 17, 'J': 7, 'Z': 12}","{'Q': 28, 'R': 14, 'S': 0, 'T': 2, 'H': 11, 'M': 0}","{'Y': 12, 'A': 11, 'B': 2, 'D': 3, 'E': 0, 'G': 12, 'I': 5, 'K': 10, 'L': 2, 'N': 5, 'O': 2, 'U': 8, 'V': 2, 'W': 1, 'X': 2}",FALSE,On Time
INV-ZZ-5945685,SCH-ZZ-2404944,ZZ,ZZ20240423PNQGAU4614,4614.0,Airbus A320-200,04/23/2024,2024-04-23 23:31:00,2024-04-24 23:12:00,PNQ,GAU,150.0,173,103,-47,70,15,30,45,60,17,10,5,7,35,21,9,14,54,32,13,22,70,42,18,28,"{'F': 6, 'P': 1}","{'C': 6, 'J': 2, 'Z': 6}","{'Q': 11, 'R': 3, 'S': 0, 'T': 0, 'H': 5, 'M': 3}","{'Y': 3, 'A': 4, 'B': 2, 'D': 1, 'E': 2, 'G': 2, 'I': 1, 'K': 1, 'L': 2, 'N': 2, 'O': 2, 'U': 3, 'V': 0, 'W': 1, 'X': 2}",FALSE,On Time
INV-ZZ-5034455,SCH-ZZ-5041804,ZZ,ZZ20240423HYDCJB2880,2880.0,ATR 72,04/23/2024,2024-04-23 23:47:00,2024-04-24 13:44:00,HYD,CJB,72.0,81,49,-23,32,7,14,21,28,8,5,2,3,16,10,4,6,25,15,6,10,32,19,9,13,"{'F': 2, 'P': 1}","{'C': 4, 'J': 2, 'Z': 0}","{'Q': 6, 'R': 2, 'S': 0, 'T': 0, 'H': 1, 'M': 1}","{'Y': 2, 'A': 1, 'B': 1, 'D': 0, 'E': 0, 'G': 2, 'I': 1, 'K': 2, 'L': 0, 'N': 0, 'O': 1, 'U': 2, 'V': 0, 'W': 1, 'X': 0}",FALSE,On Time
INV-ZZ-4793287,SCH-ZZ-1367492,ZZ,ZZ20240424MAABOM3229,3229.0,Airbus A320 Neo,04/24/2024,2024-04-24 00:52:00,2024-04-24 23:19:00,MAA,BOM,180.0,209,113,-67,96,18,36,54,72,21,11,7,10,40,22,14,18,61,33,21,28,80,43,29,37,"{'F': 6, 'P': 4}","{'C': 9, 'J': 5, 'Z': 4}","{'Q': 9, 'R': 8, 'S': 3, 'T': 1, 'H': 5, 'M': 2}","{'Y': 4, 'A': 5, 'B': 2, 'D': 1, 'E': 2, 'G': 1, 'I': 0, 'K': 4, 'L': 3, 'N': 3, 'O': 2, 'U': 4, 'V': 1, 'W': 3, 'X': 2}",TRUE,On Time
INV-ZZ-5190166,SCH-ZZ-9212586,ZZ,ZZ20240424AMDDEL3431,3431.0,Airbus A321-200,04/24/2024,2024-04-24 01:10:00,2024-04-24 07:07:00,AMD,DEL,200.0,223,133,-67,90,20,40,60,80,22,13,7,9,47,28,12,19,71,42,18,29,90,54,26,36,"{'F': 7, 'P': 2}","{'C': 13, 'J': 3, 'Z': 3}","{'Q': 9, 'R': 7, 'S': 0, 'T': 3, 'H': 7, 'M': 3}","{'Y': 6, 'A': 5, 'B': 0, 'D': 1, 'E': 2, 'G': 4, 'I': 0, 'K': 4, 'L': 0, 'N': 0, 'O': 1, 'U': 5, 'V': 3, 'W': 3, 'X': 2}",FALSE,On Time
INV-ZZ-5049255,SCH-ZZ-6469147,ZZ,ZZ20240424HYDAMD2299,2299.0,Airbus A321 Neo,04/24/2024,2024-04-24 01:59:00,2024-04-24 21:45:00,HYD,AMD,220.0,247,132,-88,115,22,44,66,88,26,14,8,12,50,27,17,23,74,40,26,34,105,56,32,49,"{'F': 10, 'P': 2}","{'C': 7, 'J': 9, 'Z': 7}","{'Q': 13, 'R': 5, 'S': 6, 'T': 0, 'H': 7, 'M': 3}","{'Y': 7, 'A': 7, 'B': 2, 'D': 1, 'E': 1, 'G': 6, 'I': 1, 'K': 7, 'L': 3, 'N': 2, 'O': 2, 'U': 4, 'V': 1, 'W': 3, 'X': 2}",FALSE,On Time
INV-ZZ-4079407,SCH-ZZ-7589545,ZZ,ZZ20240424MAATRV2008,2008.0,Boeing 787,04/24/2024,2024-04-24 02:25:00,2024-04-24 21:44:00,MAA,TRV,270.0,301,181,-89,120,27,54,81,108,31,19,8,12,62,37,17,25,93,56,25,37,130,78,30,52,"{'F': 8, 'P': 4}","{'C': 13, 'J': 7, 'Z': 5}","{'Q': 17, 'R': 9, 'S': 0, 'T': 1, 'H': 8, 'M': 2}","{'Y': 7, 'A': 7, 'B': 4, 'D': 2, 'E': 0, 'G': 7, 'I': 0, 'K': 5, 'L': 4, 'N': 2, 'O': 1, 'U': 6, 'V': 1, 'W': 2, 'X': 4}",TRUE,On Time
INV-ZZ-2006385,SCH-ZZ-9301492,ZZ,ZZ20240424AMDBOM4676,4676.0,Airbus A320-200,04/24/2024,2024-04-24 02:56:00,2024-04-24 23:00:00,AMD,BOM,150.0,169,90,-60,79,15,30,45,60,17,9,6,8,36,19,11,17,52,28,17,24,66,35,25,31,"{'F': 8, 'P': 0}","{'C': 8, 'J': 5, 'Z': 4}","{'Q': 7, 'R': 7, 'S': 2, 'T': 1, 'H': 7, 'M': 0}","{'Y': 2, 'A': 4, 'B': 2, 'D': 2, 'E': 1, 'G': 4, 'I': 0, 'K': 4, 'L': 1, 'N': 2, 'O': 0, 'U': 3, 'V': 2, 'W': 2, 'X': 2}",FALSE,On Time
INV-ZZ-8954983,SCH-ZZ-8782078,ZZ,ZZ20240424PNQGOI2738,2738.0,Boeing 777,04/24/2024,2024-04-24 05:09:00,2024-04-24 17:37:00,PNQ,GOI,425.0,491,272,-153,219,42,85,127,170,48,27,15,21,94,52,33,42,141,78,49,63,199,110,60,89,"{'F': 15, 'P': 6}","{'C': 17, 'J': 15, 'Z': 10}","{'Q': 34, 'R': 12, 'S': 2, 'T': 0, 'H': 10, 'M': 5}","{'Y': 10, 'A': 7, 'B': 4, 'D': 3, 'E': 6, 'G': 9, 'I': 3, 'K': 13, 'L': 3, 'N': 4, 'O': 4, 'U': 12, 'V': 4, 'W': 3, 'X': 4}",FALSE,On Time
INV-ZZ-8003912,SCH-ZZ-5381276,ZZ,ZZ20240424JAIDEL3278,3278.0,Boeing 757,04/24/2024,2024-04-24 06:41:00,2024-04-25 02:14:00,JAI,DEL,209.0,239,136,-73,103,20,41,62,83,24,14,6,10,46,26,15,20,74,42,20,32,93,53,30,40,"{'F': 8, 'P': 2}","{'C': 9, 'J': 6, 'Z': 5}","{'Q': 17, 'R': 7, 'S': 0, 'T': 1, 'H': 7, 'M': 0}","{'Y': 6, 'A': 5, 'B': 0, 'D': 3, 'E': 2, 'G': 5, 'I': 0, 'K': 6, 'L': 2, 'N': 1, 'O': 2, 'U': 3, 'V': 2, 'W': 3, 'X': 0}",FALSE,On Time
INV-ZZ-9787502,SCH-ZZ-2729891,ZZ,ZZ20240424GOIMAA4516,4516.0,Airbus A320-200,04/24/2024,2024-04-24 06:48:00,2024-04-25 02:04:00,GOI,MAA,150.0,175,94,-56,81,15,30,45,60,18,10,5,8,34,18,12,16,51,27,18,24,69,37,23,32,"{'F': 5, 'P': 3}","{'C': 8, 'J': 4, 'Z': 4}","{'Q': 10, 'R': 7, 'S': 0, 'T': 0, 'H': 7, 'M': 0}","{'Y': 4, 'A': 2, 'B': 1, 'D': 2, 'E': 2, 'G': 2, 'I': 2, 'K': 4, 'L': 2, 'N': 2, 'O': 0, 'U': 4, 'V': 2, 'W': 2, 'X': 1}",TRUE,On Time
INV-ZZ-4464433,SCH-ZZ-2590363,ZZ,ZZ20240424HYDDEL2294,2294.0,Boeing 757,04/24/2024,2024-04-24 06:49:00,2024-04-25 06:20:00,HYD,DEL,209.0,230,128,-81,102,20,41,62,83,23,13,7,10,47,26,15,21,69,38,24,31,93,52,31,41,"{'F': 9, 'P': 1}","{'C': 10, 'J': 5, 'Z': 6}","{'Q': 15, 'R': 8, 'S': 2, 'T': 0, 'H': 5, 'M': 1}","{'Y': 5, 'A': 4, 'B': 1, 'D': 2, 'E': 3, 'G': 3, 'I': 1, 'K': 5, 'L': 2, 'N': 1, 'O': 1, 'U': 5, 'V': 3, 'W': 3, 'X': 2}",TRUE,On Time
INV-ZZ-4078818,SCH-ZZ-4227852,ZZ,ZZ20240424GOIBOM2453,2453.0,Airbus A320 Neo,04/24/2024,2024-04-24 08:27:00,2024-04-24 13:54:00,GOI,BOM,180.0,215,125,-55,90,18,36,54,72,21,12,6,9,40,23,13,17,61,35,19,26,83,48,24,35,"{'F': 8, 'P': 1}","{'C': 7, 'J': 3, 'Z': 7}","{'Q': 11, 'R': 5, 'S': 0, 'T': 0, 'H': 8, 'M': 2}","{'Y': 5, 'A': 4, 'B': 0, 'D': 2, 'E': 3, 'G': 2, 'I': 2, 'K': 5, 'L': 3, 'N': 2, 'O': 2, 'U': 4, 'V': 0, 'W': 0, 'X': 1}",TRUE,On Time
INV-ZZ-5093981,SCH-ZZ-7588562,ZZ,ZZ20240424AMDDEL3688,3688.0,Airbus A321-200,04/24/2024,2024-04-24 10:53:00,2024-04-24 19:22:00,AMD,DEL,200.0,236,140,-60,96,20,40,60,80,23,14,6,9,47,28,12,19,69,41,19,28,89,53,27,36,"{'F': 6, 'P': 3}","{'C': 8, 'J': 7, 'Z': 4}","{'Q': 13, 'R': 6, 'S': 2, 'T': 0, 'H': 7, 'M': 0}","{'Y': 5, 'A': 4, 'B': 2, 'D': 0, 'E': 2, 'G': 3, 'I': 2, 'K': 2, 'L': 3, 'N': 1, 'O': 2, 'U': 5, 'V': 1, 'W': 2, 'X': 2}",TRUE,On Time
INV-ZZ-2376230,SCH-ZZ-3249150,ZZ,ZZ20240424BOMAMD4704,4704.0,BAe 146,04/24/2024,2024-04-24 13:45:00,2024-04-24 19:31:00,BOM,AMD,91.0,100,54,-37,46,9,18,27,36,10,5,4,5,22,12,6,10,31,17,10,14,41,22,14,19,"{'F': 4, 'P': 1}","{'C': 5, 'J': 3, 'Z': 2}","{'Q': 6, 'R': 4, 'S': 1, 'T': 0, 'H': 3, 'M': 0}","{'Y': 3, 'A': 1, 'B': 1, 'D': 1, 'E': 0, 'G': 3, 'I': 1, 'K': 3, 'L': 1, 'N': 1, 'O': 1, 'U': 2, 'V': 0, 'W': 0, 'X': 1}",FALSE,On Time
INV-ZZ-9487531,SCH-ZZ-5334272,ZZ,ZZ20240424DELMAA2093,2093.0,Boeing 717,04/24/2024,2024-04-24 14:23:00,2024-04-25 04:10:00,DEL,MAA,100.0,114,68,-32,46,10,20,30,40,11,7,3,4,22,13,7,9,35,21,9,14,47,28,12,19,"{'F': 3, 'P': 1}","{'C': 6, 'J': 2, 'Z': 1}","{'Q': 6, 'R': 4, 'S': 1, 'T': 3, 'H': 0, 'M': 0}","{'Y': 2, 'A': 1, 'B': 1, 'D': 0, 'E': 2, 'G': 2, 'I': 2, 'K': 1, 'L': 1, 'N': 2, 'O': 0, 'U': 3, 'V': 0, 'W': 0, 'X': 2}",FALSE,On Time
INV-ZZ-8212813,SCH-ZZ-8796700,ZZ,ZZ20240424CCUBLR3294,3294.0,Airbus A320-200,04/24/2024,2024-04-24 14:54:00,2024-04-25 11:38:00,CCU,BLR,150.0,174,94,-56,80,15,30,45,60,18,10,5,8,35,19,11,16,53,29,16,24,72,39,21,33,"{'F': 6, 'P': 2}","{'C': 8, 'J': 5, 'Z': 3}","{'Q': 11, 'R': 4, 'S': 1, 'T': 0, 'H': 8, 'M': 0}","{'Y': 4, 'A': 3, 'B': 0, 'D': 2, 'E': 2, 'G': 3, 'I': 2, 'K': 4, 'L': 2, 'N': 1, 'O': 0, 'U': 4, 'V': 2, 'W': 2, 'X': 2}",FALSE,On Time
INV-ZZ-6235385,SCH-ZZ-9117133,ZZ,ZZ20240424BLRCCU2504,2504.0,Boeing 777,04/24/2024,2024-04-24 15:35:00,2024-04-24 18:17:00,BLR,CCU,425.0,470,258,-167,212,42,85,127,170,50,27,15,23,100,55,30,45,140,77,50,63,197,108,62,89,"{'F': 11, 'P': 12}","{'C': 22, 'J': 12, 'Z': 11}","{'Q': 26, 'R': 14, 'S': 3, 'T': 3, 'H': 12, 'M': 5}","{'Y': 10, 'A': 12, 'B': 4, 'D': 5, 'E': 5, 'G': 11, 'I': 2, 'K': 12, 'L': 3, 'N': 3, 'O': 4, 'U': 12, 'V': 0, 'W': 2, 'X': 4}",FALSE,On Time
INV-ZZ-3384707,SCH-ZZ-1589980,ZZ,ZZ20240424BOMDEL2019,2019.0,Airbus A320 Neo,04/24/2024,2024-04-24 16:42:00,2024-04-25 04:40:00,BOM,DEL,180.0,204,123,-57,81,18,36,54,72,21,13,5,8,42,25,11,17,62,37,17,25,83,50,22,33,"{'F': 6, 'P': 2}","{'C': 5, 'J': 7, 'Z': 5}","{'Q': 13, 'R': 6, 'S': 0, 'T': 0, 'H': 6, 'M': 0}","{'Y': 5, 'A': 4, 'B': 2, 'D': 3, 'E': 0, 'G': 4, 'I': 2, 'K': 3, 'L': 1, 'N': 0, 'O': 1, 'U': 4, 'V': 2, 'W': 1, 'X': 1}",FALSE,On Time
INV-ZZ-3057117,SCH-ZZ-8346723,ZZ,ZZ20240424BLRHYD3027,3027.0,BAe 146,04/24/2024,2024-04-24 18:48:00,2024-04-25 02:58:00,BLR,HYD,91.0,107,60,-31,47,9,18,27,36,11,6,3,5,22,12,6,10,32,18,9,14,42,24,12,18,"{'F': 1, 'P': 4}","{'C': 7, 'J': 2, 'Z': 1}","{'Q': 7, 'R': 0, 'S': 0, 'T': 3, 'H': 2, 'M': 2}","{'Y': 2, 'A': 3, 'B': 1, 'D': 0, 'E': 1, 'G': 3, 'I': 0, 'K': 2, 'L': 1, 'N': 0, 'O': 0, 'U': 2, 'V': 1, 'W': 1, 'X': 1}",FALSE,On Time
INV-ZZ-1190771,SCH-ZZ-4253453,ZZ,ZZ20240424AMDMAA4012,4012.0,Boeing 757,04/24/2024,2024-04-24 19:00:00,2024-04-24 22:08:00,AMD,MAA,209.0,233,124,-85,109,20,41,62,83,22,12,8,10,47,25,16,22,69,37,25,32,93,50,33,43,"{'F': 6, 'P': 4}","{'C': 11, 'J': 6, 'Z': 5}","{'Q': 13, 'R': 8, 'S': 1, 'T': 3, 'H': 5, 'M': 2}","{'Y': 5, 'A': 4, 'B': 1, 'D': 3, 'E': 2, 'G': 5, 'I': 1, 'K': 4, 'L': 0, 'N': 3, 'O': 3, 'U': 6, 'V': 0, 'W': 3, 'X': 3}",FALSE,On Time
INV-ZZ-3958478,SCH-ZZ-2312688,ZZ,ZZ20240424MAATRV4122,4122.0,Boeing 787,04/24/2024,2024-04-24 19:54:00,2024-04-25 02:05:00,MAA,TRV,270.0,310,176,-94,134,27,54,81,108,31,18,9,13,62,35,19,27,96,55,26,41,127,72,36,55,"{'F': 10, 'P': 3}","{'C': 14, 'J': 2, 'Z': 11}","{'Q': 19, 'R': 10, 'S': 1, 'T': 0, 'H': 11, 'M': 0}","{'Y': 8, 'A': 3, 'B': 1, 'D': 4, 'E': 3, 'G': 5, 'I': 2, 'K': 7, 'L': 3, 'N': 2, 'O': 2, 'U': 8, 'V': 3, 'W': 2, 'X': 2}",TRUE,On Time
